image_url,contributor_id,gender,age_group,language,voice_clip,duration,up_votes,down_votes,transcript
https://storage.googleapis.com/image_prompts/unsplash-uwQHhyS.jpg,229,Male,30-39,Lusoga,yogera_image_audio_20231012_121726.649407_2994.wav,0.00611111111111111,3,0,Onho agemye ekyenhandha mungalodhe  nga agezaku okukyetegereza enkula yakyo era nga kighanvu ghanvu mubutondhe nga bwo kyetegereiza agho. Era nga akigemeire mumadhi takitoiremu okusobola okukikuma nga kiramu nga era bwoli kumubonha.
"https://storage.googleapis.com/image_prompts/Uganda Travel Guide, Beyond the Gorillas.jpeg",226,Male,18-29,Lusoga,yogera_image_audio_20231012_121847.314205_2382.wav,0.005,3,0,Oyo musaadha ayambaire omudoozi gwa kyenvu afungizaku amakoono. Omudoozi ogwo guliku obwalala busaatu kuluyi ne luyi paka ku nkoto
https://storage.googleapis.com/image_prompts/animal.jpg,227,Male,18-29,Lusoga,yogera_image_audio_20231012_122002.297731_2404.wav,0.00472222222222222,3,0,Waliwo ente ibiri waliwo ebigogo waliwo enkoko waliwo enhumba eyeitakka
https://storage.googleapis.com/image_prompts/These are games that keep children busy in Africa_Its so interesting. http __www.wildwhispersafrica.jpeg,214,Male,30-39,Lusoga,yogera_image_audio_20231012_122203.002883_2194.wav,0.00555555555555556,3,0,Abaana bali babiri bali kuzaanha omuzanho ogwe kika ekyo mweso. Omughala oghundi avaire olugoye oluliku elangi ya color ya kakobe owundi olwa...
https://storage.googleapis.com/image_prompts/69e7abfd-unsplash-wut21NW.jpg,227,Male,18-29,Lusoga,yogera_image_audio_20231012_122235.115821_2280.wav,0.00444444444444444,2,1,"Emicungwa ebikola bya kiragala, emicungwa dha kyenvu "
https://storage.googleapis.com/image_prompts/unsplash-IjFnT1K.jpg,236,Female,30-39,Lusoga,yogera_image_audio_20231012_122131.579451_2724.wav,0.00583333333333333,3,0,"Endhoki eli ku kimuli ekilina langi eya kyenvu, ni langi endheru. Ghaligho ekimuli ekindhi ekiri ele einhuma. Bili bibili. Ela nga ghano ghaboneka oti bwire
"
https://storage.googleapis.com/image_prompts/1692885155-9755.jpg_s=612x612_w=0_k=20_c=uowNkAbByd_r20bELEV-eu-wGKV4x2y5JLxhHsa-LdI=.jpg,236,Female,30-39,Lusoga,yogera_image_audio_20231012_122131.553695_1776.wav,0.00555555555555556,3,0,"Abantu bemeleire ku itundhiro lya amafuta. Ghaligho ayambaile olugoye olwa kasaayi. Ghabagho ali mu lugoye olwa bululu. Ghaligho engira, edhiri ghano. Ghaligho n'obubaale baale, n'obusubi obwa kiragala. "
https://storage.googleapis.com/image_prompts/a4c59f4b-_DSC0334_copy.jpg,219,Female,30-39,Lusoga,yogera_image_audio_20231012_122326.683129_1931.wav,0.00666666666666667,3,0,"Kalina eriku emyaliliro ebiri bagiserekesa amabaati ga kisitaka, ghaligho tanka endhirugavu eri ghangulu. Ghaligho omuti oguli mu langi eya kiragala."
https://storage.googleapis.com/image_prompts/1692884916-6600.jpg_s=612x612_w=0_k=20_c=V9HR4UQGBfMuXkgZZVa-eORgajIu7tLJPPUfaai470A=.jpg,214,Male,30-39,Lusoga,yogera_image_audio_20231012_122547.326448_1665.wav,0.005,3,0,Engoina eri wansi kumabali ga maadhi eyasamirire era wainuma waayo waliwo eisubi eri mulangi ya kiragala 
https://storage.googleapis.com/image_prompts/unsplash-pP3v4ix.jpg,235,Female,40-49,Lusoga,yogera_image_audio_20231012_122503.806975_2958.wav,0.0113888888888889,3,0,"Omukazi abeese omwana. Ayambaile olugoye olw'ebimulimuli. Omwana alambaile ku mugongo okwo, ali mundoolo. N'omukazi asibye ogutambala ogubba ku mutwe okwo. Alingilire enho ati, yaisa amaiso, n'omukono yesigama kule ati. Omukyala onho mwirugavu aye omwana mwerumweru. Omwana ye mweru alina obuviiri ghagati. Gha kighalaata ghalaata, obuviiri buliku bwa ghagati  bwonka."
https://storage.googleapis.com/image_prompts/35a180b4-men-6496343_1280.jpg,231,Female,18-29,Lusoga,yogera_image_audio_20231012_122624.544348_1326.wav,0.00444444444444444,3,0,"Omusaadha ayemeleire mu mpale eya gini eya bululu era agemye eisimu mungalo, mwinhe atyeime kukatebe ghansi yena agemye eisimu mungalo."
https://storage.googleapis.com/image_prompts/7699b08d-unsplash-sQlmPO3.jpg,205,Male,18-29,Lusoga,yogera_image_audio_20231012_122711.783511_2107.wav,0.00527777777777778,3,0,"Omukazi ono alaga nga ye twiise ebbafu, ebbafu erimu ebintu. Asibye ku akatambala ku mutwe yayambala ebulaghuzi emyufu. Ghano eno ebintu byali kutwala milimu epakuli, epakuli edho ndheru."
https://storage.googleapis.com/image_prompts/e3312ed5-1692885152-9720.jpg_s612x612_w0_k20_cjEm1bn7E4LgHCZq3hwg5bjkbpjJPprkP_vuKuQXV.jpg,229,Male,30-39,Lusoga,yogera_image_audio_20231012_122855.181211_1983.wav,0.00805555555555556,3,0,"Ekyo kinhonhi. Era nga tukyeta ghano, tukyeta kalooli, eliinha lyetwakinhazaaku. Ebintu ebifu kwota nh'okusiiba mu lufula okulya ebinyamanyama oba omusaayi ogusaliibwa okuva mu bisolo, ng'ente, embuzi nh'ebindhi. Era nga kibuuka kyagya eghala singa eba, kiba kighuniiza, asaze oba aise ekisolo"
https://storage.googleapis.com/image_prompts/a3a49dce-_DSC0009.JPG,226,Male,18-29,Lusoga,yogera_image_audio_20231012_122915.660871_1929.wav,0.00583333333333333,2,1,"Eyo laghundha ya lughudho mulaghundha omwo mundha mulimu akagali akemereire mwabamu nhe bipandhe, mwabamu nhe miti edhe bisansa mwabamu nhe miti edhindhi."
https://storage.googleapis.com/image_prompts/unsplash-LwyIX1Q.jpg,216,Female,40-49,Lusoga,yogera_image_audio_20231012_122929.910400_2742.wav,0.00555555555555556,2,1,"Ali mu maadhi mu lyaato, agemye omulagho ali kukuba amaadhi. Eluuyi ele, ele yali kugya ele, eliyo amaato mangyi. Yalikuva, ava munho nga agya mule, yonha eliiyo amaato galiyo mu bungyi."
https://storage.googleapis.com/image_prompts/unsplash-I5INlQN.jpg,207,Male,18-29,Lusoga,yogera_image_audio_20231012_122936.838161_2721.wav,0.0102777777777778,2,1,"Baleese ghano omusaadha ali kumuzinga, ali ku ndhoki, ali kumuzinga. Yesabike bulungi endhoki tidhisobola kumuluma, ali kumuzinga. Ayambaile gilavusi aye dhiri mu kala eya kyenvu. Yebwise omutwe ayambaileku ne'nkofira, alighalino ali kumuzinga kuno kuliku ebikambala kule kwabaku kadhenene ali agho alisandukula ne'ndhoki edindhi dhimuliku"
https://storage.googleapis.com/image_prompts/1692884912-6548.jpg_s=612x612_w=0_k=20_c=pX9f9ihcjWM_vGrAyvWhGT10tnEbGyVTztUrnUfgk6g=.jpg,219,Female,30-39,Lusoga,yogera_image_audio_20231012_122955.941599_1658.wav,0.00527777777777778,3,0,"Abantu bali mu katale, batunda. Ghaliwo engoye. Kumbali okwa katale kuliku dhi kalina. Ghangulu we kalina waliwo ekidomola ekya maadhi nga kiri mu langi endirugavu "
https://storage.googleapis.com/image_prompts/pexels-photo-4483669.jpeg,205,Male,18-29,Lusoga,yogera_image_audio_20231012_122938.261366_2537.wav,0.00638888888888889,2,1,"Ghano enho ghaligho abakazi, babano enho aye beswile distance, beswile amabanga, beswile amabanga. Eliyo omukaile, eliyo omukazi onho ali mu maiso ghano enho, eliyo byali kubuuza omukaile. Ekiri nti baidhye, oba baidhye okuba idhandhaba. Beswile amabanga, bataileku nhi mask ku minhwa. Mpola mpola agho eliyo byebali kubabuuza."
https://storage.googleapis.com/image_prompts/1692884976-7550.jpg_s=612x612_w=0_k=20_c=S0UZd3OK3hcqzs8vFgssdzWV6JG3xcs2QEHhkbPKwyc=.jpg,220,Female,30-39,Lusoga,yogera_image_audio_20231012_123054.030740_1703.wav,0.0116666666666667,2,1,"Oluguudo luli kumbali, oluguudo luli ghaghati. Kumbali kuno eliyo emiti n'eisubi. Ni kumbali enho kuliku emiti n'omuti.
 Emiti gyiri mu laangi ya ya kiragala. Embeli ere agh'oluguudo eliyo omulongooti n'amayumba. Amayumba gali mu laangi eya kiragala. "
https://storage.googleapis.com/image_prompts/unsplash-JtSkfUz.jpg,229,Male,30-39,Lusoga,yogera_image_audio_20231012_123202.265192_2732.wav,0.00472222222222222,3,0,"Onho atyaime, batyaime babili. Nga oghundhi agemye camera, ali gezaaku okwetegeleza ebibali embeli, era nh'oghundhi ataile ekintu munkoto oba omusipi ogugemye e camera eyo."
https://storage.googleapis.com/image_prompts/945f34d7-unsplash-ntrBozM.jpg,223,Female,18-29,Lusoga,yogera_image_audio_20231012_123117.592858_2124.wav,0.00527777777777778,2,1,Enyama ey'enkoko bali gikalilira. Omuntu aboneseeku emikono nga ali gikyusa nga aveire esati eri mu langi endheru.
https://storage.googleapis.com/image_prompts/71efa0c5-g3656046a1d392d5bbe3e9b62be6334ac9f803aeab081aa9de804accddbfc12d98cb3_WENlj1i.jpg,223,Female,18-29,Lusoga,yogera_image_audio_20231012_123117.573030_2285.wav,0.005,3,0,"Abasaadha bali basatu nga bali kulwanhisa ente. Ababili bali enho mabali, omulala ali enho. Abambaile esaati edha colour endheru. Era nga ghaligho nh'olugo lulimu ente nhingyi."
https://storage.googleapis.com/image_prompts/unsplash-7xuwtTY.jpg,207,Male,18-29,Lusoga,yogera_image_audio_20231012_123418.057258_2641.wav,0.01,2,1,"Ali wano, ali kulaga ekigere kiri mwibbanga, kiriku omupiira. Omupiira gwona gulifanana kisitaka nga eitakka bweliri kufanana. Ali kudonga. Nowundi ebigere biryere kumbali biraga nga alikwidayo. Ne bisense biriku. Neera kisense ekyono  ali kudonga kikino ne kyole wulele era kyona ekisense kiriwo. Ali kudonga, bisense biriwo no mupiira guliwo na magulu bali kudonga ali kusamba"
https://storage.googleapis.com/image_prompts/1692884916-6618.jpg_s=612x612_w=0_k=20_c=WD0FxXteoOU9_PR0-0fDs2r_9oCXGAv_6CCjDMR7aMw=.jpg,229,Male,30-39,Lusoga,yogera_image_audio_20231012_123506.301921_1196.wav,0.00583333333333333,2,1,"Ekiganha ky'ente nga era dhili gezaaku okuba nga dhilingiliire yedhili kugya. Mulimu edha mayiga amaghanvu, dhe banhazaaku edhiva ebunholo. Mwaba edha maadhi  era nga dhili mu colour emyuufu oba ey'akasaayi, kwota endhirugavu edhili enhuma ghaadho. "
https://storage.googleapis.com/image_prompts/1692885172-10055.jpg_s=612x612_w=0_k=20_c=bfwLcQ7K1okmkr6Tsv0LXWoNPXoj5gNSG1rLYeNZ3AQ=.jpg,206,Male,18-29,Lusoga,yogera_image_audio_20231012_123402.854274_1783.wav,0.005,2,1,"Ebiwago ebya menvu, amenvu gebeeta bogoya. Bogoya ono ali mu langi ya kyenvu. Bogoya ono aliika. Era waliwo ne bibo wabawo ne sefuliya era nga bitundibwa"
https://storage.googleapis.com/image_prompts/unsplash-R9E1lII.jpg,214,Male,30-39,Lusoga,yogera_image_audio_20231012_123359.838544_2779.wav,0.00555555555555556,2,1,"Omusaadha nga agemye mu mikono dhe mulimu enkofira, avaire ekikomo mu mikono dhe no mudhoozi ogwe mikono emiwanvu ogwa bulu"
https://storage.googleapis.com/image_prompts/8a4076ae-ge8a1706f95b612fc1469b69278296a66cec07cf9a0482e17e456da8b55f2eb832d51_GC1GVPI.jpg,219,Female,30-39,Lusoga,yogera_image_audio_20231012_123642.412212_2117.wav,0.00666666666666667,3,0,"Abaana bataanu bava ku nsulo kusenha maadhi. Abana betiise ebidhomola ku mitwe, omulala ataile ekidhomola ku gaali. Mungyira, eitaka ly'engyira lya kisiitaka. Kumbali okw'engyira kuliku dhuuma, enhimiro ya dhuuma."
https://storage.googleapis.com/image_prompts/etehwuwie.jpg,230,Female,18-29,Lusoga,yogera_image_audio_20231012_123653.648899_2480.wav,0.005,2,1,"Omusaadha alina eivha kugaali, endhagi, n'enhanha nga dhili kumughangi.

Alina ebintu ebindhi mu buveera obwelu embeli. Alina akagaali, ekitebe kya kala myufu.

"
https://storage.googleapis.com/image_prompts/1692884849-5806.jpg_s=612x612_w=0_k=20_c=b2mPp6LbUoHoNB8DnxBDXNAl5FfnlKnMXMAqBBe4vVM=.jpg,223,Female,18-29,Lusoga,yogera_image_audio_20231012_123604.865331_1498.wav,0.00472222222222222,2,1,Amaadhi gali mu miti ghagati. Emiti mighanvu dhiri mu langi eya kilagala era  nga erughyi nhe rughyi eriyo emiti amaadhi gali kulukutiramu.
https://storage.googleapis.com/image_prompts/1692884855-5899.jpg_s=612x612_w=0_k=20_c=uN5Q-ZFH5ozWFer6K3Xwxxq6ZPUPIkJd4RxanTRzA0A=.jpg,219,Female,30-39,Lusoga,yogera_image_audio_20231012_123642.439661_1572.wav,0.00833333333333333,2,1,"Omwaalo nga guliku amaato abantu abali kumaato nga amaato ago gali mu maadhi, amaato agandhi gali kumbali, abantu abemereire kumbali okwa maadhi, obuyumba obuzimbe kumbali, akandhi akalala akasooka kazimbe nha mabaati akokubiri kasereke neisubi elya kisitaka.
 "
https://storage.googleapis.com/image_prompts/35a180b4-men-6496343_1280.jpg,236,Female,30-39,Lusoga,yogera_image_audio_20231012_123918.581464_1401.wav,0.00555555555555556,2,1,"Omusaadha ayemeleire nga availe akagoye akeeru, nga yesibye akantu akamyuufu ku mutwe.
 Ali mu ngaito endheru ne mpale ya bululu. Ayemeleire ku gho musaadha ayambaile omudhoozi ogwa bululu, nga atyaime ku katebe ak'ebibaawo. Ghaligho ebintu bingyi inho agho."
https://storage.googleapis.com/image_prompts/1692884855-5907.jpg_s=612x612_w=0_k=20_c=aG-s0fd7uvXqhDDdVe9mNsC9-3qg29o4t2dNprwJRyM=.jpg,209,Male,18-29,Lusoga,yogera_image_audio_20231012_123940.921136_1580.wav,0.00472222222222222,2,1,"Emiti emisimbe egyakalitusi emingi mukala eya kilagala nga myaghule yaghule, nga ghaligho emito nemikulu nga dhilimu obugira mwabamu obuti obundhi obuli mukala eya kisitaka."
https://storage.googleapis.com/image_prompts/28fe2b1e-kabaka-2314792_1280.jpg,209,Male,18-29,Lusoga,yogera_image_audio_20231012_123940.930594_1802.wav,0.00527777777777778,3,0,"Kabaka owa Buganda nga atiame mu ntebbe nga katikirro ali kwogera naye nga eriyo omusirikale amuli einhuma, kuliku na mukuuma owo buwangwa mule mumbali ng' ali kwogera ni katikirro bwaseka
"
https://storage.googleapis.com/image_prompts/unsplash-ObCdaqa.jpg,213,Male,18-29,Lusoga,yogera_image_audio_20231012_124152.635428_2758.wav,0.005,2,1,"Ndhi kubona, kubona enhandha. Era ndhi kubona ghano abantu ghaligho abali kughugila mu nhandha. Ghaligho..."
https://storage.googleapis.com/image_prompts/unsplash-R9E1lII.jpg,206,Male,18-29,Lusoga,yogera_image_audio_20231012_124259.275028_2779.wav,0.00555555555555556,3,0,"Omusaadha ayambaile omudhoozi ogwa bululu nga agemye enkoofira endheru. Agitweile ku mutwe, ali kugyetegereza mundha mwayo, era nga amale agyizeeku ku mutwe."
https://storage.googleapis.com/image_prompts/2eb6154a-unsplash-PSMi7BY.jpg,223,Female,18-29,Lusoga,yogera_image_audio_20231012_124403.120440_2235.wav,0.00472222222222222,3,0,"Emotoka eri mu lugudho, entulege eri kumbali egiringirile. Eyemeleire mu busubi obwa kala ya kiragala nga entulege erimu amadowadowa. Emotoka eri kugya."
https://storage.googleapis.com/image_prompts/unsplash-lG8tMKd.jpg,223,Female,18-29,Lusoga,yogera_image_audio_20231012_124403.097093_2921.wav,0.00472222222222222,2,1,Abalenzi bataanu bali mukisaawe ekyo mupiira bali kusanuka. Abandi bambaire engoye ediri mu kala dha kyenvu abandi bululu bali kulumuka 
https://storage.googleapis.com/image_prompts/1692885152-9715.jpg_s=612x612_w=0_k=20_c=herkRpIhPyKN1IUwNEkrxjmcEqHSu1BnKe2_l-Tnz8k=.jpg,219,Female,30-39,Lusoga,yogera_image_audio_20231012_124335.986166_1296.wav,0.00527777777777778,3,0,"Esente dhe nsi Uganda. Aka papula aka kiragala ka nkumi tanu, aka papula aka kisayi ka mitwalo ebiri, aka papula aka kisitaka ka lukumi "
https://storage.googleapis.com/image_prompts/unsplash-maoTJDd.jpg,225,Female,18-29,Lusoga,yogera_image_audio_20231012_124437.421490_2932.wav,0.00611111111111111,2,1,"Ghaligho omwami ayemeleire kumpi nh'amaadhi. Omusana gwakavaayo nga guli mu laangi eya eya kakyungwa. Nhebileri byagwo bili kuboneka nga birugavu irugavu, nh'ebindhi byeeru. Omwami onho ayemeleire ali oti availe birugavu agemye akati akavuba ebyenhanda."
"https://storage.googleapis.com/image_prompts/Parliament of Uganda Building, Kampala, Uganda.jpeg",208,Male,18-29,Lusoga,yogera_image_audio_20231012_124839.392923_2185.wav,0.0075,2,1,Wano omulyango ogwingira ekifo agha tesezebwa oba olukiko olukulu olwe eighanga Uganda gheri tekeza era nga kumbali kwo luguudho lunho kwetoloirwa ebendhera edheighanga lya Uganda.
https://storage.googleapis.com/image_prompts/f5b201d6-unsplash-vTUlJDT.jpg,212,Male,30-39,Lusoga,yogera_image_audio_20231012_124922.173270_2485.wav,0.0105555555555556,2,1,"Ndiboona amagyi, obutiko, enhaanha, bunamulebwe, vakedo, kamulali, green pepper, butungulu. Amagyi meeru, obutiko bwa kikuusi kitaka, vakedo gha kiragala, green pepper gha kiragala, kamulali gha kiragala, enhaanha dha myufu."
https://storage.googleapis.com/image_prompts/35a3370c-g704fe70fc096a790a2032c9d9a710565480b7b1b9dac48d400c12d3eaee704dbae72_U397EJU.jpg,210,Male,18-29,Lusoga,yogera_image_audio_20231012_124856.177147_2238.wav,0.00555555555555556,3,0,"Endovu n' ente edo munsiko, bino binoni biri mumaadhi diri kufuna kumaadhi ago kunwa kubanga dibaire dimaze olunaku lulamba nga dirikuwulira enhonta byasalawo bidhe binwe kumaadhi "
https://storage.googleapis.com/image_prompts/unsplash-5ZDIn6a.jpg,226,Male,18-29,Lusoga,yogera_image_audio_20231012_125005.961511_2615.wav,0.00722222222222222,2,1,"Abo baana bali basatu bemeleire ku nhumba ensereke nhe'isubi. 
Ogha ghagati agemye pikya agitaile ku liiso, ali kubonha, nsubira alina gwaligya okupikya."
"https://storage.googleapis.com/image_prompts/Uganda Travel Guide, Beyond the Gorillas.jpeg",207,Male,18-29,Lusoga,yogera_image_audio_20231012_125256.340574_2382.wav,0.0108333333333333,2,1,"Bakuleteire ghano  omusaadha ayambaire omudhozi, omudhozi guliku Uganda court of arms. Kuliku n'omupiira, kuliku Crested Crane, nga eliku ghano n'omupiira, kwabaku  n'ekigambo, kiliku FUFA, kwabaku adidas, kwabaku Uganda. Kuliku elangi emyufu kwabaku omudhozi gwabaku elangi eya kyenvu kwabaku n'endheru. Ali wano alikumirimo gye."
https://storage.googleapis.com/image_prompts/1692884916-6618.jpg_s=612x612_w=0_k=20_c=WD0FxXteoOU9_PR0-0fDs2r_9oCXGAv_6CCjDMR7aMw=.jpg,213,Male,18-29,Lusoga,yogera_image_audio_20231012_125220.670678_1196.wav,0.00527777777777778,2,1,Ndikuboona ente obuto ne nkulu nga donadona diri walala wano era mwabamu ente erina ebirugavu ne byeru. Aye oidhi nga diri muluguudo aye ghaliwo eisubi ne isaka
https://storage.googleapis.com/image_prompts/d29b66d1-unsplash-srjaNEj.jpg,231,Female,18-29,Lusoga,yogera_image_audio_20231012_125713.786978_2449.wav,0.00416666666666667,3,0,Abaana babili bali kutunga ebitambala. Oghundhi ali sekeraku mwinhe. Agemye ebitambala ebyewuuzi byebali kutunga. 
https://storage.googleapis.com/image_prompts/The Uganda You Dont See in the News.jpeg,226,Male,18-29,Lusoga,yogera_image_audio_20231012_125925.729518_2376.wav,0.00472222222222222,2,1,Abavubuka bali kupanga tanuulu. Era oghundhi ali kusomba amatofali nga agaletela mu wheelbarrow. Oghundhi ayemeleire aghali ensuwa.
https://storage.googleapis.com/image_prompts/1692885059-8503.jpg_s=612x612_w=0_k=20_c=80rJi96jI82yeFl1poxBdbd25b0hlNhc7ylC_8m4pjM=.jpg,224,Male,18-29,Lusoga,yogera_image_audio_20231012_130030.566543_1737.wav,0.00416666666666667,2,1,Gbanho ghetuli ghaligho gyebeta swiki eya masanhalaze eriku ebituli oba swiki ibiri ndala aye eliku ebituli bibiri. Gheri ghebagita ekisenge kifanana kisitaka yenhe ndheru.
https://storage.googleapis.com/image_prompts/1692880134-479.3_ixid=M3wxMjA3fDB8MHxzZWFyY2h8MjB8fHVnYW5kYXxlbnwwfHwwfHx8MA_3D_3D_w=1000_q=80.jpg,230,Female,18-29,Lusoga,yogera_image_audio_20231012_130115.321306_1492.wav,0.00472222222222222,3,0,"Abaana bali kutunga ebitambaala. Bali kutunga, aye onho oghundhi musanhufu inho asanhwiike inho. Bali ku isomero abandhi bali kweghandikira"
https://storage.googleapis.com/image_prompts/1692884875-6170.jpg_s=612x612_w=0_k=20_c=uJiMsjQXH4vF--ulhlJm7-vK8fPvnnWVLD75DRjukPY=.jpg,229,Male,30-39,Lusoga,yogera_image_audio_20231012_130319.626883_1621.wav,0.00527777777777778,2,1,Ekiyumba ekye bisolo era nga kiboneka okuba kiyumba kya nte nga bwokibona nga mumbali gwakyo waliwo enhumba eya matafali ekali okubibwaku pulasita. Mumbali ere eriyo ekiyumba  ekiringa ekye mbidi nga bwo kirengera mu kiragala wakyo
https://storage.googleapis.com/image_prompts/unsplash-sXS8BB9.jpg,226,Male,18-29,Lusoga,yogera_image_audio_20231012_130433.527474_2982.wav,0.00555555555555556,3,0,"Edo mbiri diri isatu diri mwisubi waliwo no muti aye nga ensagga edindi diziraku makoola, disisa emitwe wansi"
https://storage.googleapis.com/image_prompts/93e766fe-_DSC0437_copy.jpg,223,Female,18-29,Lusoga,yogera_image_audio_20231012_130617.206667_1894.wav,0.00444444444444444,2,1,Elyaato lirimu obutimba ni yingini no mugoba walyo liri kumabali ge naandha. Omugoba walyo ayambaire engoye wansi empale eri mu color ya ndirugavu 
https://storage.googleapis.com/image_prompts/c46b6a88-mwanje-henry-_Zb5-tOmEes-unsplash.jpg,227,Male,18-29,Lusoga,yogera_image_audio_20231012_130537.342495_1446.wav,0.00444444444444444,2,1,"Emotoka eli mungyira. Egaali etwiise ku amatooke, n'abantu bemeleire kumbali. N'ebigogo..."
https://storage.googleapis.com/image_prompts/Image Prompts/Fishing/unsplash-wxczDFM.jpg,227,Male,18-29,Lusoga,yogera_image_audio_20231012_130537.356327_2358.wav,0.00416666666666667,3,0,"Enhandha, kuliku abaghuga. Side eyindhi kuliku amabaale. Enhandha yetoloire olusozi."
https://storage.googleapis.com/image_prompts/eca30d40-unsplash-50u3nF8.jpg,231,Female,18-29,Lusoga,yogera_image_audio_20231012_130631.410129_2470.wav,0.00416666666666667,2,1,Ekibira kirimu emiti emighanvu ne mimpi. Emiti edho dha kiragala ne'isubi lyakiragala. Ere eriyo obuyumba bumpimpi.
https://storage.googleapis.com/image_prompts/59ed872f-unsplash-0SGhFuT.jpg,219,Female,30-39,Lusoga,yogera_image_audio_20231012_131028.141216_2269.wav,0.00472222222222222,3,0,"Omusaadha ayemereire mu muceere, ayambaire saati ya kapere, agemye ekiibo, kumbali okwo muceere kuliku emiti egirimu langi yakilagala."
https://storage.googleapis.com/image_prompts/8a4076ae-ge8a1706f95b612fc1469b69278296a66cec07cf9a0482e17e456da8b55f2eb832d51_GC1GVPI.jpg,216,Female,40-49,Lusoga,yogera_image_audio_20231012_130832.518485_2300.wav,0.00416666666666667,2,1,"Ebikaadho. Abaana abava amaadhi abetwiise ebidhomolo. Nh'oghegaali ali kugya, kuluuyi kunho kukagyira."
https://storage.googleapis.com/image_prompts/unsplash-5ZDIn6a.jpg,207,Male,18-29,Lusoga,yogera_image_audio_20231012_131521.704120_2615.wav,0.00722222222222222,3,0,"Ghano ghaligho abaana. Bali basatu. Oghundi ali kulengeza mu pikya, oghundi agiriku yene agyigemye. Agigemye pikya, agemye camera eyo. Oghundi ataire omutwe einhuma, ghaligho enhumba, bagiserekesa eisubi
"
https://storage.googleapis.com/image_prompts/Christian school gives hope to abused Ugandan children - Mission Network News.jpeg,209,Male,18-29,Lusoga,yogera_image_audio_20231012_131431.224369_2138.wav,0.00722222222222222,2,1,Abaana abali mukibiina no musomesa nga   balikusiiga ebifanani mulangi edhendhaghulo nga mulimu langi aya kirekire mwabamu langi eya kyenvukyenvu mwabamu langi eya kasayisayi nga bambaire engoye edhiri mulangi edhendhaghulo nga batyaime ku ma benkyi.
https://storage.googleapis.com/image_prompts/1692885055-8450.jpg_s=612x612_w=0_k=20_c=EpdTPlGdV6uxR7sqCE1EadG1SYpBXoAT3RFUuPQovIQ=.jpg,209,Male,18-29,Lusoga,yogera_image_audio_20231012_131431.213990_1735.wav,0.00555555555555556,3,0,Amanda amapange kumbali kwekikomela ekye' nimiro eyemiti kumpi ne kibali nga bagapanze mu bukutiya obweru obunene no butono. Waliwo engoye ediri mu kala enderu ne diri mu kala emyufu 
https://storage.googleapis.com/image_prompts/2d7cc1e4-_DSC0003.JPG,216,Female,40-49,Lusoga,yogera_image_audio_20231012_131544.859898_1808.wav,0.00555555555555556,3,0,"Nhumba dha kalina. Nga ghano ghaligho obu shade obutini, oba bu shade bwebasalaku, nhi ghano ghaligho obuti bwa shade bwebasalaku. N'eluuyi ele eliyo ekiti, kiri mungeri ya kimuli aye nga kiti, n'engira egya ghaka."
https://storage.googleapis.com/image_prompts/eeq.jpg,214,Male,30-39,Lusoga,yogera_image_audio_20231012_131558.752051_2473.wav,0.00444444444444444,2,1,"Abatunzi abe byo kulya kunguudo, bali kutundha ebyokulya nga babibisa mu madhinisa gabasi ghedhemerera."
https://storage.googleapis.com/image_prompts/business1.jpg,210,Male,18-29,Lusoga,yogera_image_audio_20231012_131640.598013_2423.wav,0.00472222222222222,2,1,Omulenzi alikupima sumbusa era azinzezinzemu ekipapula bulungi inho aghe omuntu ghuyo eidhye okumughagira asobole okweyongerayo.
https://storage.googleapis.com/image_prompts/46fef2ab-g31a21446e1534f0129daa8378875c016c69d788a4c843e601f4ab460754609178fd6_dEbHmZV.jpg,236,Female,30-39,Lusoga,yogera_image_audio_20231012_131806.260362_2254.wav,0.00527777777777778,3,0,"Omusaadha ali kuvuga pikipiki, nga ali kuvugira kwitaka ely'olukyangakyanga.  Ghaligho ghano olusolo olwamagulu amaghanvu n'enkoto empanvu lulala. Einuma ere ghaliyo emiti egibonheka otiti minhaazi."
https://storage.googleapis.com/image_prompts/unsplash-uwQHhyS.jpg,228,Female,40-49,Lusoga,yogera_image_audio_20231012_131808.667855_2994.wav,0.00694444444444444,2,1,"Omusaadha agemye ekyenandha. Ekyenandha kino kirimu obulangi obwirugavu, kumbali kuliku obulangi bwa kyenvu ate nga bali mu maadhi amairigavu"
https://storage.googleapis.com/image_prompts/unsplash-kcxGNSw.jpg,229,Male,30-39,Lusoga,yogera_image_audio_20231012_132057.518533_2912.wav,0.00444444444444444,3,0,Obukebe obuterekeibwamu omubisi gwe nduki era nga guboneka gwakutunda. Bbabutaireku ni kifuulanho oba obupapula obutunda obusikiriza omuguzi
https://storage.googleapis.com/image_prompts/NDSU Agronomist Helping Improve Ugandas Coffee Production.jpeg,212,Male,30-39,Lusoga,yogera_image_audio_20231012_131938.894799_2183.wav,0.00694444444444444,2,1,Omukazi alikunoga emwaani nga emwaani edo diriku amakoola aga kiragala. Emwaani kuliku edakiragala embisi. Enenvu mmyuufu. Kwababaku amakoola amenvu aga yelllow. Omukazi ayambaire blouse ndirugavu
https://storage.googleapis.com/image_prompts/DSC_0400.JPG,227,Male,18-29,Lusoga,yogera_image_audio_20231012_132002.459076_1920.wav,0.00416666666666667,3,0,"Enhumba, toyi, ebivera emiyandhu ebiyigo."
https://storage.googleapis.com/image_prompts/Image Prompts/Fishing/unsplash-trCkmdM.jpg,225,Female,18-29,Lusoga,yogera_image_audio_20231012_132126.175000_2357.wav,0.00583333333333333,2,1,Ghaligho omwana kunhandha alikuvuba yenayena ye'sabike bulung kumbali kule ghaligho ensozi edhendhaghulo nga dhiri mulangi eyo'muzirazira ne'bireri byabbululu ebindhi byeru ghabaagho no'lubaalebaale kubukalu ghenhandha.
https://storage.googleapis.com/image_prompts/unsplash-4hEjGBJ.jpg,225,Female,18-29,Lusoga,yogera_image_audio_20231012_132126.210832_2610.wav,0.00583333333333333,3,0,Obwaana buli mu kisaawe aghalala nh'omutendesi ghaibwe. Nga bavaire e uniform gye bazanhiramu omupiira. Ghabagho akatimba mwebateebera omupiira. Ekisaawe kyona kyona kilambikiibwa bulungi. N'obwana buvaire e stocks mu langi emyufu. 
