image_url,contributor_id,gender,age_group,language,voice_clip,duration,up_votes,down_votes,transcript
https://storage.googleapis.com/image_prompts/1692884912-6575.jpg_s=612x612_w=0_k=20_c=esqdT_0wMPsFf0_GG8h41MkkOREZio2T7hgKdULT_aI=.jpg,208,Male,18-29,Lusoga,yogera_image_audio_20231012_103259.497021_1662.wav,0.00833333333333333,3,0,"Ekanisa.
Ekanisa nnenhe yetoloirwa emiti gino egiba muluya, egisimbibwa muluya, emisansa ate nga waliwo nobuti obumpibumpi, obumuli muli, ebimuli ebyendawulo nebiri oti bikosi, bigogwa"
https://storage.googleapis.com/image_prompts/unsplash-pVD0w75.jpg,231,Female,18-29,Lusoga,yogera_image_audio_20231012_144306.072096_2960.wav,0.00444444444444444,3,0,Endhoki dhili ku pikakampa byadho dhili kunwamu omudhenhenhe. Mu bikakampa mulimu obutulituli. Ghaliyo agemyeeku nh'omukono ku kikamkampa.
https://storage.googleapis.com/image_prompts/1692884852-5840.jpg_s=612x612_w=0_k=20_c=pLpM32rICJmG8aCt8IDcQtCh_RBquvC0ylttQXqSGiI=.jpg,236,Female,30-39,Lusoga,yogera_image_audio_20231012_131806.248143_1526.wav,0.00666666666666667,3,0,"Abantu basatu nga kuliku abakazi babili  abetiise, abagemye ebisawo ku migongo gyaibwe, bagema n'ebiti. N'omusaadha mulala yena nga agemye ekisawo ku mugongo gwe, nga ataileku n'ekikofiira bali kutambula mu luguudo olw'olukyangakyanga, era nga abakazi bambaile agagaito. Omukazi oghundi ali kadhoozi aka kiragala. "
https://storage.googleapis.com/image_prompts/ac36dbed-Untitled-1_copy.jpg,229,Male,30-39,Lusoga,yogera_image_audio_20231012_135312.735917_1940.wav,0.00472222222222222,2,1,"Emotoka oba ebilumuka ghagati mu luguudho. Nga ebindhi bili kugya, ebindhi bili kwila. Nga era kumabali kuliku nhi abo bupikipiki, nga boona bali mu luguudho. Era ghagati mu Town okumpi n'ebitaala..."
https://storage.googleapis.com/image_prompts/1692884852-5856.jpg_s=612x612_w=0_k=20_c=LUsl6aM0MZHgEhVcb_m3nWcKE8bXby-ESFkAEvUupyk=.jpg,298,Female,18-29,Lusoga,yogera_image_audio_20231013_134644.668179_1542.wav,0.00444444444444444,3,0,"Ekisolo kili ghagati, ensudhe eli ghagati mu miti mu kibira. Era nga etyaime ghagati mu kibira. Emiti egyikyetoloire gyirimu laangi eya kiragala. "
https://storage.googleapis.com/image_prompts/63b84c54-ankole-cows-2111168_1280.jpg,211,Male,30-39,Lusoga,yogera_image_audio_20231012_143606.662037_1852.wav,0.00555555555555556,3,0,Ente didino dirikulya eisubi. Mulimu eda mayiga mawanvu eda mayiga amampi endirugavu nenderu doona diryawo diri kulya eisubi. Diziraku buzibu bwonabwona dirkwelira eisubi. Aye eno erina amayiga ha! Elioti bwaki! 
https://storage.googleapis.com/image_prompts/1692884916-6599.jpg_s=612x612_w=0_k=20_c=6tIzmJqSFBf4UFSt2ryKhvQSB-8-iVb-fa-9DfvHHE8=.jpg,236,Female,30-39,Lusoga,yogera_image_audio_20231012_151746.968240_1191.wav,0.00694444444444444,3,0,Engoina eli kumbali agho okw'amaadhi. Eli kulinda eky'okulya kubanga yo elya bintu bya musaayi. Era kumbali kw'amaadhi ghaligho nh'obusubisubi. Nh'amaadhi mugabona gaago. Eliyo nh'ebibaalebaale. Era yona efaanhanha oti bibaalebaale.
https://storage.googleapis.com/image_prompts/petro.jpg,289,Female,30-39,Lusoga,yogera_image_audio_20231013_113447.717910_2517.wav,0.00888888888888889,3,0," Sitenseni ghe banhwera amafuta. Ogha pikipiki agyiire okumugha amafuta. Ghaligho omusaadha ayambaile ekidhoozi kya colour ya kasaayi alimugha. Emotoka eyemeleire ghambali. Akatebe ka colour ya bululu, laangi ya bululu.  Omukazi ali mumbali"
https://storage.googleapis.com/image_prompts/unsplash-QQKjmLs.jpg,219,Female,30-39,Lusoga,yogera_image_audio_20231012_100407.857085_2771.wav,0.00638888888888889,2,1,"Omusaadha alina eisimu mungalo. Ayambaile esaati ya kapere. Alina esaawa kumukono, ogundhi...omukono ogundhi kwabaku ekikomo...ekikomo oba ekinhere. Ayambaile empale ya khaaki. "
https://storage.googleapis.com/image_prompts/1692884868-6066.jpg_s=612x612_w=0_k=20_c=MVA9F9wp1Gwj0rCoF4AWa-pTmyqIgdaiO0LqIyQ5WVw=.jpg,289,Female,30-39,Lusoga,yogera_image_audio_20231013_120148.180768_1135.wav,0.00444444444444444,3,0,Eno paaka ya takisi. Etakisi edindi diri kuyingira edindi diri kufuluma. Abantu bali kutambula.
https://storage.googleapis.com/image_prompts/Image Prompts/Fishing/unsplash-pvp0jIn.jpg,293,Male,18-29,Lusoga,yogera_image_audio_20231013_112018.350292_2173.wav,0.005,3,0,"Abavubi bali kunhandha bali kusika katimba, bali kusika katimba bwebakatoola munhandha. Balikusika bambeire ebikofira ku mitwe bano ababiri abasoka. Oghundhi owokusatu yeyambula engoye, ayambwire esaati.  Owokuna yayambala aka vesti, asoseyo ele."
https://storage.googleapis.com/image_prompts/1692884855-5891.jpg_s=612x612_w=0_k=20_c=fi45-8I8qh2EuEm5m9ny9UT6JegfsiHshXYMRVPi9oA=.jpg,229,Male,30-39,Lusoga,yogera_image_audio_20231012_103726.476964_1565.wav,0.00944444444444444,1,2,"Edho, badeeta mbuzi. Dhiri omughendo gwaadho dhiri ikumi na itanu nga mulimu endhirugavu, mwabaamu enderu edirimu amabala aga kikuusikuusi oba kakobe, mwabaamu enderu edhiziramu kala yonayona,  era nga dhiri kutambula nga dhambuka. Dhiri saidi ndala, nga bwodetegereza dhonadhona era nga ebiloghozo bidhitaile gyedhirikugya."
https://storage.googleapis.com/image_prompts/1692884965-7299.jpg_s=612x612_w=0_k=20_c=xLozIz7r52Fl5h0nxY_g3L3V-0ChcAzwSia5DOy5Vsc=.jpg,235,Female,40-49,Lusoga,yogera_image_audio_20231012_151406.824177_1225.wav,0.00416666666666667,2,1,"Ghano ndhi bonagho emotoka endheru, endhirugavu, n'eyakyenvu. Emberi gh'emotoka edho eriyo emiti egiriku amakoola nga ga kiragala. "
https://storage.googleapis.com/image_prompts/1ae037e3-g7ace7d088ceb8bc714861178e9ff117def1a73a0cef5f60fdc7bd79838668b206c6c_MoVh5hi.jpg,226,Male,18-29,Lusoga,yogera_image_audio_20231012_122313.931356_2224.wav,0.00638888888888889,3,0,Omwana atyaime ku lubalaza olw'enhumba. Olubalaza olwo lubongofu aghandhi. Ghaligho n'engoye edhanikibwa ku wire eli kuliya.
https://storage.googleapis.com/image_prompts/These are games that keep children busy in Africa_Its so interesting. http __www.wildwhispersafrica.jpeg,296,Female,40-49,Lusoga,yogera_image_audio_20231013_103359.824158_2377.wav,0.00444444444444444,3,0,Bunho obwaana buli kuzaana kyeso kya ghansi ku itaka. Akandhi kavaile ekivaalo kya kakobe oghundi kya bululu. Obuyumba buliku edhintu edhighanvu aye nga basereka mwandho ku mwandho. Obuyumba bwa isubi buligho bungyi era eitaka lya kisiitaka. 
https://storage.googleapis.com/image_prompts/unsplash-maoTJDd.jpg,290,Male,18-29,Lusoga,yogera_image_audio_20231013_120606.204816_2932.wav,0.0105555555555556,3,0,"Omusaadha ayemeleire mu maadhi aye kumbali kwago matonotono gaalimu, omulengera ebigere bye eifo. Aye bwolingirira alinga agemye eilobo nga ataile, mu maadhi ago. Era ebireri bili kubonekamuku oti kyerukyeru, oti kayi kasaayi saayi, oba nga, kale byamala byalagamuku oti kyenvu kyenvu. Bilaga nga endhuba bweba tiyakavaayo, yakagwa."
https://storage.googleapis.com/image_prompts/unsplash-d3Q33Vc.jpg,229,Male,30-39,Lusoga,yogera_image_audio_20231012_142609.729765_2863.wav,0.00444444444444444,2,1,Ebimuli bya kapapali era nga bisagambu bulungi. Wangulu wabyo waliwo enduki eri kugezaku okunununta omubisi. Era nga bikoze kala ya kiragala nga bwona awo 
https://storage.googleapis.com/image_prompts/1692884916-6613.jpg_s=612x612_w=0_k=20_c=MeoDopOqSG4AE76Xk9Ax2G7fLQHf184TrMKdwY1bLlc=.jpg,226,Male,18-29,Lusoga,yogera_image_audio_20231012_115256.095171_1195.wav,0.00583333333333333,3,0,"Empuuli eyemereire munsiko nga myufu. Enindho ndirugavu. Ndikukireivu wano owe bigere, ebyemberi birugavu. Ewangalaiza amatu"
https://storage.googleapis.com/image_prompts/a4c59f4b-_DSC0334_copy.jpg,227,Male,18-29,Lusoga,yogera_image_audio_20231012_102332.370570_1931.wav,0.00472222222222222,2,1,"Enhumba ya kalina ibiri, ya mategula erina tanka ya maadhi endirugavu no muti mu luya"
https://storage.googleapis.com/image_prompts/unsplash-8yyTFPv.jpg,274,Male,18-29,Lusoga,yogera_image_audio_20231013_100101.553530_2653.wav,0.00527777777777778,3,0,"Omuntu nga ali kukyuuma eky'abazungu, kalimagezi. Nga alibaaku byakitaamu oba byakiragila okukola, era nga bwakisaba n'ebintu ebivaamu ebyo byayenda okola."
https://storage.googleapis.com/image_prompts/unsplash-8TnOFbj.jpg,236,Female,30-39,Lusoga,yogera_image_audio_20231013_071620.301544_2646.wav,0.00583333333333333,3,0,Endhoki dhigemye akadhegere akabonhero akalagah nti dhiri kwisa kirala okwisanya nhamanhi ebikumu ebibiri nhe biita ensekere agali aghalala nha agaluma enyama. Tuli kitole twisa kirala endhoki bwedhikoze.
https://storage.googleapis.com/image_prompts/unsplash-fIXCQmY.jpg,307,Female,30-39,Lusoga,yogera_image_audio_20231013_113639.588375_2875.wav,0.00444444444444444,2,1,"Ekimuli kiliku ebikoola ebya kisiitaka, kilimu ebirugavu ghaghati. Kili mu bintu, mu kisaawe ekiirugavu, kiliku ebya kisiitaka ghaghati. "
"https://storage.googleapis.com/image_prompts/Dusty Orange - Jinja, Uganda.jpeg",274,Male,18-29,Lusoga,yogera_image_audio_20231013_090711.168654_2325.wav,0.00583333333333333,3,0,"Oluguudho olw'omukyalo nga luli kukasozi, nga lwa itaka, era nga lulimu n'ebiinha. Nga lutambuza abantu ababooda, abebigere, ni ab'emotoka okuva eluuyi n'eluuyi."
https://storage.googleapis.com/image_prompts/1692884885-6303.jpg_s=612x612_w=0_k=20_c=65whJUv-mf78eAAN7QAc-mpzB5g8bXP8CFnrZ-LKT1Q=.jpg,302,Female,40-49,Lusoga,yogera_image_audio_20231013_150225.359190_1636.wav,0.00444444444444444,3,0,"Abantu betoloire ekiziimbe ekiliku e colour ya kyenvu. Abantu...ghaligho emotoka, ghaligho oluguudo lulimu ebikonko."
https://storage.googleapis.com/image_prompts/fb475aac-unsplash-pNrDXhM.jpg,277,Female,50-59,Lusoga,yogera_image_audio_20231013_142337.072440_2489.wav,0.00444444444444444,3,0,Emwani dhino dhi kaali mbuudhu. Dhonadhona dha kiragala. Amakoola ne mwani dhene dha kiragala. Omuti guno guliku ensagga kamaala ne mwani dhoona ediriku nhingi
https://storage.googleapis.com/image_prompts/unsplash-Ja74Rba.jpg,290,Male,18-29,Lusoga,yogera_image_audio_20231013_121413.498453_2729.wav,0.00722222222222222,3,0,"Ekighuka ekiri mulangi eya kyenvu nga kumutwe kuliku obutooloze obwirugavu, kwabaku nengeri oti ya buswere nha magulu ga kyo nga galina amayungiro magimangi kwona kwabaku obuswere swere."
https://storage.googleapis.com/image_prompts/1692884916-6626.jpg_s=612x612_w=0_k=20_c=iu42fnvT7kJPGWvm5i3WEul9YR1L-fNL9gQqtmY-iXM=.jpg,207,Male,18-29,Lusoga,yogera_image_audio_20231012_124830.414894_1200.wav,0.00694444444444444,2,1,"Balese wano emotoka edindi diri wansi edindi diri kukizimbe wangulu. Diraga nga waliwo diri kukalina wangulu emotoka. Diriyo ningi di parkinze, edindi di parkinze wansi ne bizimbe ebisinga bya kalina. Mperani wano waliwo ne miti gya kiragala."
https://storage.googleapis.com/image_prompts/709228c6-unsplash-kJM9Ht2.jpg,274,Male,18-29,Lusoga,yogera_image_audio_20231013_092043.255557_2284.wav,0.00527777777777778,3,0,Eitooke nga lizitoweirereyo inho era lireteire ne kigogo okwewendeka ku nhumba eyali kumbali agho nga era ekifo kino kyetoloiremu na matooke oba ebigogo ebindhi 
https://storage.googleapis.com/image_prompts/386aa52d-unsplash-SW3Ncj6.jpg,225,Female,18-29,Lusoga,yogera_image_audio_20231012_143425.833927_2241.wav,0.005,3,0,"Akakembo nga kali ku muti, ku itale nga ketoloirwa ensiko, eyindhi elaga nga nkalu, eyindhi elaga nga ya kiragala. Akakembo kano kali mu laangi endhirugavu nhi laangi endheru. "
https://storage.googleapis.com/image_prompts/1692884855-5897.jpg_s=612x612_w=0_k=20_c=_JjM9mQ86dKMPNeR035zZXatNm9zxPfVKYuqX0C6rBI=.jpg,291,Female,30-39,Lusoga,yogera_image_audio_20231013_134409.425265_1570.wav,0.00444444444444444,2,1,"Entulege eri tambula. Nhingi diri tambulira munsiko aye nga itaka lyerere. Entulege dino da langi ibiri, enderu ne ndirugavu "
https://storage.googleapis.com/image_prompts/unsplash-o4OOw6d.jpg,222,Female,30-39,Lusoga,yogera_image_audio_20231013_074230.394901_2943.wav,0.00611111111111111,2,1,Ghano ndi'bona enhandha enhandha ndi'bona amaadhi nga galikutambula ndi'gabona nga mangi nga gali'tambula nga galiku amayengo.
https://storage.googleapis.com/image_prompts/1692884855-5895.jpg_s=612x612_w=0_k=20_c=nqftDaQpiDh36DlSlwmKeRuP71DixhaTFyuxzfM9XNE=.jpg,309,Male,30-39,Lusoga,yogera_image_audio_20231013_125426.274464_1569.wav,0.00472222222222222,2,1,"Ebisolo byemeleire ghagati mu nsiko. Ebisolo binho ba byeta entwiga, ebindhi byemeleire ku muti, aghali omuti. Omuti gunho guliku amakoola, amakoola gali mu kala eya kiragala."
https://storage.googleapis.com/image_prompts/Image Prompts/Fishing/a2414e1a-gfa02c9fc2cae30d1e8dd28aec9dcd6c4f75daf83b2b684cb5c952ab021541287d296_a8yDfx2.jpg,274,Male,18-29,Lusoga,yogera_image_audio_20231013_083701.231606_2147.wav,0.00722222222222222,3,0,"Enhanda nga eliku amaato agakozesebwa okuvuba nga era ebinhonhi biri bita ghangulu bwe bibuuka mu ibanga bwebyeyagala, bwe bimala bwebigya bwe biwumulilaku ku maato, bwe bivaku era bwe bibuka okuva ku maato  ganho agakozesebwa okuvuba ebye nhandha
"
https://storage.googleapis.com/image_prompts/goats.jpg,288,Male,18-29,Lusoga,yogera_image_audio_20231013_124255.915198_2506.wav,0.00444444444444444,3,0,Embuzi nga erikulya eisubi nga bagisibyemu omuguwa munkoto nga eri mulanji endhirugavu nhi lanji endheru.
https://storage.googleapis.com/image_prompts/unsplash-7VfhbD4.jpg,208,Male,18-29,Lusoga,yogera_image_audio_20231012_145235.853733_2633.wav,0.005,3,0,Bali mu kuzaanha omuzano gunno ogwokozesa amani nga bazaanha omupiira ogwo kulumuka no nomupiira mu mikono era nga omulala asitwire mwine era abaire no mupiira agukasukire mwine
https://storage.googleapis.com/image_prompts/pexels-photo-4332584.jpeg,231,Female,18-29,Lusoga,yogera_image_audio_20231012_140359.151864_2536.wav,0.00444444444444444,3,0,"Omusaadha ali ku lyato, agemye kubibala. Ghaligho ebibala bingi, obutunda, emiyembe, amenvu, wabaawo   n'amaadhi mu budoome"
https://storage.googleapis.com/image_prompts/unsplash-pVD0w75.jpg,298,Female,18-29,Lusoga,yogera_image_audio_20231013_122357.727908_2960.wav,0.00444444444444444,3,0,Endhuki dhi gwire kumasasala omuba omubisi gwe dikola. Dhona dhonha dhi tyaime ku masasala omuli  omubisi gwe dhikola.  Dhiri kutaamu omu dhenhenhe.
https://storage.googleapis.com/image_prompts/Image Prompts/Fishing/a2414e1a-gfa02c9fc2cae30d1e8dd28aec9dcd6c4f75daf83b2b684cb5c952ab021541287d296_a8yDfx2.jpg,309,Male,30-39,Lusoga,yogera_image_audio_20231013_114744.572104_2147.wav,0.005,2,1,"Amaato gali ku maadhi. Ebinhonhi biri kubuluka mu ibanga.
Amaato galimu elaangi endhirugavu, n'elaangi emyuufu. "
https://storage.googleapis.com/image_prompts/1692885065-8616.jpg_s=612x612_w=0_k=20_c=Pzmfr2VYXcKOl94NCUWdVllUzJRCzqaO3qz9k80G00Y=.jpg,227,Male,18-29,Lusoga,yogera_image_audio_20231012_115408.407330_1747.wav,0.00416666666666667,3,0,Abakazi na basaadha bali kwemba webakuba engoma. Bavaire emigaire
https://storage.googleapis.com/image_prompts/1692884979-7568.jpg_s=612x612_w=0_k=20_c=_mLtXHv-FFWoZgkp1DbUKSaKut32FHU-T14oN9iv7-M=.jpg,286,Male,30-39,Lusoga,yogera_image_audio_20231013_122906.555545_1704.wav,0.00472222222222222,2,1,"Gano amatooke gali abiri. Matooke manene, matooke mawanvu, era nga gali mulangi ya kiragala gonagona nga bwe gali amatooke abiri"
https://storage.googleapis.com/image_prompts/1692884885-6287.jpg_s=612x612_w=0_k=20_c=KKuDcWua6PaqreZIK_75aBUwPJU8bWKtITD4SBLo2bM=.jpg,290,Male,18-29,Lusoga,yogera_image_audio_20231013_112326.963379_1633.wav,0.00555555555555556,3,0,Eisinzizo lye bazimba mu kyentoloze liri ghangulungulu ku lusozi era nga lyalinhanha emiti mingi n'eisubi elya kiragala ghansi ghalyo.
https://storage.googleapis.com/image_prompts/Image Prompts/Fishing/unsplash-N35Nwds.jpg,280,Female,18-29,Lusoga,yogera_image_audio_20231013_115015.911652_2345.wav,0.00555555555555556,3,0,"Endhuba eya kavayo kunkyo eri kwaka elangi eyakyenvu era nga eri kwakira ku maadhi ago kunhandha, nho musaadha ayambeire engoye endhirugavu endherere aye nga dhonha dhiri kwakiramu langi eya kyenvu."
https://storage.googleapis.com/image_prompts/1692885084-8733.jpg_s=612x612_w=0_k=20_c=oZ3QrIPfXth9aRGxzSUUNDX5VADiWY9sqOuiD6dMxJI=.jpg,302,Female,40-49,Lusoga,yogera_image_audio_20231013_151954.228486_1279.wav,0.00472222222222222,2,1,"Oluguudo lwaitaka kumabali kuliku eisubi lya kiragala, kumabali kuliku amayumba galimu endhigi dha bululu, kumbali kuliku emiti giriku color yakiragala."
https://storage.googleapis.com/image_prompts/1692885084-8757.jpg_s=612x612_w=0_k=20_c=FMUDTv9FqFLP2G2AagMymK_z2wFtyHtqiVeE7jbJjag=.jpg,219,Female,30-39,Lusoga,yogera_image_audio_20231012_143628.022216_1281.wav,0.00472222222222222,3,0,"Ekibira kyamiti, emiti egyo gili mu langi ya kilagala. Bazimbamu obuyumba nga babuserekesa mabatti, amabati ago meeru mulimu nengudho, engudho edho dhalangi yakisitaka."
https://storage.googleapis.com/image_prompts/5cfc4d6e-bicycle-5819891_1280.jpg,274,Male,18-29,Lusoga,yogera_image_audio_20231013_095743.443187_1844.wav,0.005,2,1,Omusaadha nga ali bita ku bantu bwasilingisa egaali ye. Era nga onho aligya mu mirimo gye nga afungizaku empale era nga mwetegefu okugya gyagya
https://storage.googleapis.com/image_prompts/1692884956-7157.jpg_s=612x612_w=0_k=20_c=LyINE1Znyc56_ivk_GkENxv8VnLPKLopQ4H91rF9pC8=.jpg,29,Female,30-39,Lusoga,yogera_image_audio_20230827_125842.141779_1224.wav,0.00444444444444444,2,1,"Muno mulimu ebizimbe Kamaala, ebizimbe bino bighanvu inho, era byonabyona babisiiga langi. Ndhi bona n'engudho, ndhi bona n'emotoka."
https://storage.googleapis.com/image_prompts/1692884880-6241.jpg_s=612x612_w=0_k=20_c=wtAi5CvHl3vX-xdorPwhZJusSsE6Us_Ob9dXK6RljXA=.jpg,41,Female,18-29,Lusoga,yogera_image_audio_20230825_094940.142268_1152.wav,0.00861111111111111,2,1,"Abasaadha babili bali tambula mu nsozi, bali tambula mu mwiiga ogulimu amaadhi n'ebityanka. Munsozi mulimu emiti n'eisubi. Omusadha owundi abeekeire ensawo ya yellow, nga agemye n'omuti. Omusaadha owundhi agemye ensawo endhirugavu n'enkofiira ya black ku mutwe."
https://storage.googleapis.com/image_prompts/1692884889-6330.jpg_s=612x612_w=0_k=20_c=PGeIn4LjP4v8lecWOrs8Uz-LkcnTr9qeDYX8Io9rULQ=.jpg,32,Male,18-29,Lusoga,yogera_image_audio_20230825_095114.163173_1171.wav,0.00416666666666667,2,0,"Ensenhenhe dhiri kusiikibwa okubonhekere okuba nga dhitegekebwa okulibwa abantu ng'era dhiri ku muiko, dhirimu obuito 
dhabamu nh'obutungulu."
https://storage.googleapis.com/image_prompts/75327c7a-ugandan-crafts-ZWxPGOcUzR4-unsplash.jpg,32,Male,18-29,Lusoga,yogera_image_audio_20230825_095114.141855_1421.wav,0.00555555555555556,2,1,"Omutunzi oghengoye alinha olugoye lwali kutunga, ayenga alikulutunga ekyuma ekitunga kiri kubisamu eghuuzi nga ghansi ghakyo atailegho olugoye nga alinha akapimo akapima obughanvu bw'olugoye bweyandhiyenze okubonekera nti atunga."
https://storage.googleapis.com/image_prompts/1692884889-6343.jpg_s=612x612_w=0_k=20_c=NokctyTSRHkfv_amCFWXYx62YRZti8wkw2h9hzbupwU=.jpg,35,Female,30-39,Lusoga,yogera_image_audio_20230825_095227.667510_1173.wav,0.00472222222222222,2,1,"Dhino nsenene,  dhagwa mumweezi ogwa Musenene.  Mulimu edha kiragala, mulimu emyufu. Dhili kumeeza."
https://storage.googleapis.com/image_prompts/1692884868-6066.jpg_s=612x612_w=0_k=20_c=MVA9F9wp1Gwj0rCoF4AWa-pTmyqIgdaiO0LqIyQ5WVw=.jpg,38,Male,18-29,Lusoga,yogera_image_audio_20230825_095259.936345_1135.wav,0.00833333333333333,2,0,"Ekibuga amatakisi ghegemerera, dheni abantu baabo balikugya ku ganhinamu batambula nga bagya mu saidhi  edhendhaghulo, abandhi bali kuigiri abandhi bali kufuluma. Takisi dhirimu mulimu ebika bingi inho ebyemotoka. Mulimu takisi, mwabaamu dhi kosita mwabaamu nhenguudho."
https://storage.googleapis.com/image_prompts/f167f301-andrew-itaga-1mxdsIhSZMY-unsplash.jpg,38,Male,18-29,Lusoga,yogera_image_audio_20230825_095259.926101_1456.wav,0.00527777777777778,2,0,"Omukazi ali kutembeya amasoghani, ebikopo, baafu  adhitaile ku mutwe, then yayambala olugoye nga lumyufu. Alikugya mu katale era agho ghaali  ali kutambula nga ayolekera akatale."
https://storage.googleapis.com/image_prompts/1692885055-8441.jpg_s=612x612_w=0_k=20_c=Po8O0WuJSOU6D17Wtp-mY_WqI2cwnl9iLG-u8uJqg1U=.jpg,41,Female,18-29,Lusoga,yogera_image_audio_20230825_095529.262577_1259.wav,0.0111111111111111,2,0,"Abalenzi basatu baliiva maadhi. Bagemye ebidomola, ate nga balitambula muluguudo. Omulenzi owundi ayambaire esaati ya kyenvu n'empale ndirugavu. Owokubiri ayambaire empale ndirugavu, n'esaati eyakyenvu, n'ekooti endirugavu. Omulenzi owundi ayambaire empale endirugavu n'esaati ya blue nga kuliku ebigambo eby'akasaayi"
https://storage.googleapis.com/image_prompts/98d2c2f4-random-institute-vgRjl3r8XmA-unsplash.jpg,32,Male,18-29,Lusoga,yogera_image_audio_20230825_095523.860471_1432.wav,0.00555555555555556,2,0,"Abantu bali kutambula, bulyomu alikujja yagya. N'emotoka dhemeleire, edhindi dhili kwenda kuboneka okuba nti dhisimbula, ate nga edhindi dhemeleire bwemelere. Nga mulimu nomusaadha owakagaali ali kuvuga enkota dh'amatooke, nga alina gyali kudhitwaala."
https://storage.googleapis.com/image_prompts/08d9b2fa-uganda-5005579_1280.jpg,32,Male,18-29,Lusoga,yogera_image_audio_20230825_095921.897411_998.wav,0.00444444444444444,2,0,"Omusadha alikutwika enkota edhamatoke ku pikyikyi, nga pikyipikyi elina yeli kudhitwala nga elidhitola kunimiro eyamatoke."
https://storage.googleapis.com/image_prompts/0c237ef9-jeff-ackley-GdF3dozJUEk-unsplash.jpg,32,Male,18-29,Lusoga,yogera_image_audio_20230825_100536.868415_999.wav,0.00583333333333333,2,1,"Abaana babiri, Omulenzi n' omuwala. Omulenzi ali kuvuga gaali eriku ebidomolo bya maadhi, ng' ali kuyambibwaku omuwala agemereire ebidomolo bino ebya maadhi bitagwa nga bali kubitwala gye babitwala yonayona."
https://storage.googleapis.com/image_prompts/1692885155-9724.jpg_s=612x612_w=0_k=20_c=Fzoznd3l8s7Mafv1dOCwKWxcsnqTgaaYoj3kPGd85Ck=.jpg,32,Male,18-29,Lusoga,yogera_image_audio_20230825_101304.907557_1297.wav,0.00444444444444444,2,0,"Abagwiira babiri, nga bano balaambuzi, bali kulaambula ekitundu. Nga mulimu omukazi agemye embago eibiri, n'omugugu kumutwe, nga ono ava munimiro."
https://storage.googleapis.com/image_prompts/5cfc4d6e-bicycle-5819891_1280.jpg,41,Female,18-29,Lusoga,yogera_image_audio_20230825_101325.876207_1338.wav,0.00916666666666667,2,0,"Omusaadha agemye egaali, ava mukatale, einhuma gho' musaadha ghaligho omuntu oghundhi ali kukinha, aye onho omusaadha ayambaile empale eya bulu, yayambala nhe' saati eya kasaayikasaayi eyafutuuka  era einhuma gho' musaadha onho ghaligho engoye nho' bwaana obuto obwemeleire."
https://storage.googleapis.com/image_prompts/1692885055-8437.jpg_s=612x612_w=0_k=20_c=W9eYlBfxcZYczWCM8_mFcN7oaOETtQJMm2NQyPTOWnI=.jpg,32,Male,18-29,Lusoga,yogera_image_audio_20230825_101931.505078_1256.wav,0.00416666666666667,3,0,Enhaandha nga enho eriraine kumpi ne miti nobusisira abwa bantu mwebaba  nga era bunho bubonekera okuba nti busanhukirwamu.
https://storage.googleapis.com/image_prompts/1692884875-6161.jpg_s=612x612_w=0_k=20_c=hFPkoulwFAcII7o-ED45yMcgQaCKVDz9M8Qui_yHpSU=.jpg,41,Female,18-29,Lusoga,yogera_image_audio_20230825_102150.222068_1144.wav,0.005,2,0,"Embuzi dhiri mu nsiko dhiri kulya eisubi, ensiko enho eri kumbali kwo'mwiga ogulimu amaadhi agamaanhi amangi, era nga mu mwiga omwo mulimu nha'gabaale agaba."
https://storage.googleapis.com/image_prompts/d52e91f0-street-6771492_1280.jpg,32,Male,18-29,Lusoga,yogera_image_audio_20230825_102252.406982_1374.wav,0.00444444444444444,2,0,Omuvubuka agemye emikyungwa giri ku mugongo gwe egindhi gili mungalo nga agitaile mu buvera alikugitundha mu motoka na mapikipiki agali kubita kuluguudo lunho.
https://storage.googleapis.com/image_prompts/f3de6549-uganda-2314807_1280.jpg,32,Male,18-29,Lusoga,yogera_image_audio_20230825_102252.397723_1384.wav,0.005,2,0,Abakuumi b' eidembe nga wano waliwo abasirikale batayiame ku motoka nga ate abasirikale ababbiri bemereire nga ono owemberi agemye emundu;  emuli mberi
https://storage.googleapis.com/image_prompts/1692885186-10225.jpg_s=612x612_w=0_k=20_c=FQBVw6bN4ln5i1rGHBQFaqwVH_mtEjAACqqs51jh5Lw=.jpg,41,Female,18-29,Lusoga,yogera_image_audio_20230825_102150.201893_1312.wav,0.00444444444444444,2,0,"Bano basaadha bazimbi, bali ziimba kulubalama olw'enandha. Kumpi nawantu webali ziimba, waliwo omuti ogw'omuyembe."
https://storage.googleapis.com/image_prompts/1692884965-7346.jpg_s=612x612_w=0_k=20_c=hfpxU8OSaOpQtZF4DA8h3y9EOR_HWNIhD-O2iBiLvc0=.jpg,29,Female,30-39,Lusoga,yogera_image_audio_20230825_102945.672794_1229.wav,0.00472222222222222,2,1,Balikuzimba kizimbe ekizimbe kino kiboneka oti kanisa kuba ndikubonaku omusalaba aghandi bamalagho aye aghandi bakazimbanga
https://storage.googleapis.com/image_prompts/1692885068-8638.jpg_s=612x612_w=0_k=20_c=BJbbLPln1vScvFGrYGC1DNQQBthLG79bI8btLHO05CA=.jpg,29,Female,30-39,Lusoga,yogera_image_audio_20230825_102945.653043_1275.wav,0.00527777777777778,2,1,"Ndi boona omusaadha. Omusaadha ali kusindika gaali. Avaire n'enkofwiira.

Enhuma ew'omusaadha oyo, eriyo abantu abandhi. Abantu bano bali bana.

Ndi bona oluguudo. Oluguudo luno lwa itaka."
https://storage.googleapis.com/image_prompts/e14f9fa3-giraffe-4437819_1280.jpg,41,Female,18-29,Lusoga,yogera_image_audio_20230825_103412.292824_1376.wav,0.00472222222222222,2,0,"Omusaadha ali vuga pikpiki mu luguudo, nga kumbali kwa pikipiki kuliku ekisolo kiri sala oluguudo "
https://storage.googleapis.com/image_prompts/4099070c-hennie-stander-cYPbGVr3njE-unsplash.jpg,32,Male,18-29,Lusoga,yogera_image_audio_20230825_103807.244112_1403.wav,0.00416666666666667,2,0,"Abasaadha babili bali ku lyaato nga owundhi ali kuvuga elyaato munandha eno, nga ate owundhi alikusuula akatimba akavuba engege. "
https://storage.googleapis.com/image_prompts/1692884894-6377.jpg_s=612x612_w=0_k=20_c=PdkenFC0cjpMvmGuI9oBV6hcish36MfL19y5wQ7w4XA=.jpg,41,Female,18-29,Lusoga,yogera_image_audio_20230825_103951.026815_1179.wav,0.0075,2,0,"Dhino nhumba nga dhili mu luya olutereeze obulungi. 

Enhumba esooka emberi era esinga bunene, bagiserekesa eisubi mungeri entereevu. Kunhumba okwo kuliku akantu kebataile kukisenge, akazikiza omuliro."
