image_url,contributor_id,gender,age_group,language,voice_clip,duration,up_votes,down_votes,transcript
https://storage.googleapis.com/image_prompts/1692885059-8509.jpg_s=612x612_w=0_k=20_c=KzmtgQWNXn9uM0GPszCPZjI-HVUQh2rTmh0AovWMPDI=.jpg,280,Female,18-29,Lusoga,yogera_image_audio_20231013_094934.271326_1739.wav,0.00583333333333333,3,0,"Obutebe bupaangibwa ghalala. Obutebe obundhi buli mu laangi ndirugavu. Obutebe obundhi buli mu laangi ya kivuuvu. Einhuma gho butebe buno eliyo obusubisubi, buli mu laangi ya kiragala. Era nga obusubi buno bumeze ku lubaalebaale."
https://storage.googleapis.com/image_prompts/unsplash-oabMxrl.jpg,291,Female,30-39,Lusoga,yogera_image_audio_20231013_094949.372714_2949.wav,0.00611111111111111,3,0,Omusaadha ali mu maadhi nh'elyaato lili mu maadhi. Agemye akatimba ali kasika okuva mu lyaato. Elyaato lya engine.
https://storage.googleapis.com/image_prompts/836a9ed9-unsplash-qs8M77B.jpg,291,Female,30-39,Lusoga,yogera_image_audio_20231013_094949.404559_2295.wav,0.00444444444444444,3,0,Omutyeere guli kusoghola. Amakaba gagwo gali mu laangi eya kiragala. Nga bye gusoghoile bili mu laangi eya kyenvu.
https://storage.googleapis.com/image_prompts/fb475aac-unsplash-pNrDXhM.jpg,273,Male,18-29,Lusoga,yogera_image_audio_20231013_095058.751992_2489.wav,0.00555555555555556,3,0,Emwanhi edhikali kutukana kukungulwa dhino dhinhirira inno ekilaga nti dhiri mu kiffo ekigimu.
https://storage.googleapis.com/image_prompts/unsplash-DrqntSy.jpg,300,Male,18-29,Lusoga,yogera_image_audio_20231013_095210.488101_2692.wav,0.005,3,0,Mwaana mulenzi aghanike omukono ayambeire omudhozi omu myufu. Ghayemeleire ghaligho emberi ekisenge.
https://storage.googleapis.com/image_prompts/836a9ed9-unsplash-qs8M77B.jpg,303,Female,18-29,Lusoga,yogera_image_audio_20231013_095149.798294_2112.wav,0.00472222222222222,2,1,Omutyeere guli ni langi ya kiragala gwataku omutyeere muwanvu 
https://storage.googleapis.com/image_prompts/1692884916-6625.jpg_s=612x612_w=0_k=20_c=OVsewbG4aByU5RWTw5cNi0jdruNuY8kCsjt6c5CsyIw=.jpg,300,Male,18-29,Lusoga,yogera_image_audio_20231013_095210.516802_1672.wav,0.00694444444444444,3,0,"Kalina enho bali kugiziimba, aye ekaali kuwa bulungi nga bweli meant okuba. Ghaligho embeli ele emiti, egyiri mu kala ya kiragala. "
https://storage.googleapis.com/image_prompts/unsplash-7QlpEzk.jpg,273,Male,18-29,Lusoga,yogera_image_audio_20231013_095318.333329_2632.wav,0.00555555555555556,2,1,"Omwaana omughala ali kusamba akapira era ngo nho alikukasambira mu bigere, kilaga nti yali ali kukasamba nga alinha gwali kukaghereza."
https://storage.googleapis.com/image_prompts/803cc9d1-ugandan-crafts-B1N8nzKauds-unsplash.jpg,299,Male,30-39,Lusoga,yogera_image_audio_20231013_095414.847476_1875.wav,0.00527777777777778,2,1,Omukazi atyaime ali tunga ekyalaani. Ali kozesa emikono n'ebigere. Nga ali tunga omukazi onho ayambaile olugoye oluliku ekyeeru n'ekirugavu.
https://storage.googleapis.com/image_prompts/1692884875-6170.jpg_s=612x612_w=0_k=20_c=uJiMsjQXH4vF--ulhlJm7-vK8fPvnnWVLD75DRjukPY=.jpg,290,Male,18-29,Lusoga,yogera_image_audio_20231013_095431.230664_1148.wav,0.00666666666666667,3,0,"Oluyumba lwe bazimbisa emiti ne baluserekesa amabaati, einhuma walwo eliyo enhumba gye bazimbisa amatafaali yona bagiserekesa mabaati. Wansi waadho waliwo eisubi erya kiragala "
https://storage.googleapis.com/image_prompts/1692884894-6377.jpg_s=612x612_w=0_k=20_c=PdkenFC0cjpMvmGuI9oBV6hcish36MfL19y5wQ7w4XA=.jpg,274,Male,18-29,Lusoga,yogera_image_audio_20231013_095457.563058_1652.wav,0.00583333333333333,3,0,"Obusisira obweira obwe nhumba edeira ede nono nga dizimbibwa era nga diboneka bulungi, compoundi nungi nga diweweibwa no busubi obulungi obudi bonesa obulungi einho"
https://storage.googleapis.com/image_prompts/c13307ad-1692885139-9474.jpg_s612x612_w0_k20_cultGKykg_yXraVdizjTzgpP__PVtruGq_xqDyQgu.jpg,274,Male,18-29,Lusoga,yogera_image_audio_20231013_095743.420754_1958.wav,0.00611111111111111,2,1,Ebinooni bibiri nga biri muntobazi era nga ekifo kya kiragala inho nga biri tambula okunonia ekyo kulya nga era ekifo kino kyetoloirwaku no bumuli era nga kirimu neisubi eirungi eihno
https://storage.googleapis.com/image_prompts/1692885055-8437.jpg_s=612x612_w=0_k=20_c=W9eYlBfxcZYczWCM8_mFcN7oaOETtQJMm2NQyPTOWnI=.jpg,301,Female,18-29,Lusoga,yogera_image_audio_20231013_095824.628229_1729.wav,0.00666666666666667,3,0,Enhumba dhiri ku lubalama olwa maadhi ne miti. Emiti gino gilina amakaba aga kilagala. Enhumba dhino badhiserekesa isubi.
https://storage.googleapis.com/image_prompts/727ba330-unsplash-pceMMLT.jpg,297,Male,18-29,Lusoga,yogera_image_audio_20231013_095748.098035_2286.wav,0.005,2,1,"Amakerenda ga bika bingi. Mulimu aga bululu aga kakyungwa, ameeru na ga kyenvu. Amakerenda gano eno galimu enfanaanha ga box na ga square na ga...."
https://storage.googleapis.com/image_prompts/1692884916-6625.jpg_s=612x612_w=0_k=20_c=OVsewbG4aByU5RWTw5cNi0jdruNuY8kCsjt6c5CsyIw=.jpg,273,Male,18-29,Lusoga,yogera_image_audio_20231013_095856.959172_1199.wav,0.00527777777777778,3,0,Ekizimbe ekye myaliliro egyi ghelaku nga kili mu kuzimbibwa. Kino kiilaga nga ekyali kinatera okugha.
https://storage.googleapis.com/image_prompts/1692884852-5856.jpg_s=612x612_w=0_k=20_c=LUsl6aM0MZHgEhVcb_m3nWcKE8bXby-ESFkAEvUupyk=.jpg,273,Male,18-29,Lusoga,yogera_image_audio_20231013_095856.992933_1542.wav,0.00527777777777778,2,1,Eizike ligandaire. Lino liri mukibira era nga lizira mbolodani yonayona. Lye gandilire bwa gandalire
https://storage.googleapis.com/image_prompts/pexels-photo-258510.jpeg,283,Male,18-29,Lusoga,yogera_image_audio_20231013_095904.394300_2524.wav,0.00527777777777778,3,0,"Enho n'engira eya train. Era nga ghano ghe...ghano ghegezaaku okuba nga eyawukira okuva ku luguudho, okugya ku luguudho olundhi, olwa yo."
https://storage.googleapis.com/image_prompts/9af61585-_DSC0270.JPG,276,Female,60 and above,Lusoga,yogera_image_audio_20231013_091415.862697_1898.wav,0.00972222222222222,2,1,Emotoka eli kutambulira mu lugudho olukolansige obulungi. Ba lwaghulamu ebitundhu bibiri nhe langi endheru. Emberi ghe motoka eyo eriyo olutindho era lwakisitaka. Kuluyi nhi kuluyi kuliku emiti era basagha bulungi eisubi.Ghaligho olugudho olukerekeitira kukasozi kumbalimbali era nga lwaitaka era lufanhanha kisitaka. Ghaboneka bulungi
https://storage.googleapis.com/image_prompts/1692885222-10577.jpg_s=612x612_w=0_k=20_c=HDhQbtpqbyfyiiumebcIC-_bAMVERlyjxLF_TaDjLHU=.jpg,274,Male,18-29,Lusoga,yogera_image_audio_20231013_100101.573542_2220.wav,0.00694444444444444,2,1,Ente kamaala olugwo olulamba era nga dino diriku amayiga amawanvu era nga dhegombesa nga dhonadhona diri kunekaneka nga diriku no mulaalo ali diva einhuma nga diri kuva awantu nga dhirina wediri gyira mukutambulira mu lukunguliro lulala
https://storage.googleapis.com/image_prompts/36658550-unsplash-Y7Z9iq1.jpg,274,Male,18-29,Lusoga,yogera_image_audio_20231013_100101.563437_2240.wav,0.005,3,0,"Endhovu enhenhe nga egyiire ku kayandha okwefunhira ku maadhi ag'okunhwa era nga etailemu ekinhwa kyayo mu ekyo ekiyiriro kya maadhi, okufunha amaadhi ag'okunhwa."
https://storage.googleapis.com/image_prompts/03f1a1e2-unsplash-Nr01r98.jpg,294,Female,18-29,Lusoga,yogera_image_audio_20231013_100154.746493_2199.wav,0.00666666666666667,2,1,"Omwana agemye enhanha dhili mu kaveera. Nhenvu. Yagema esente. Ka nkumi ibiri, kali mu langi ya bulu. Nh'ekiibo kili agho kili mu langi ya kitakataka. Amabaale gali kumbali agali mu langi endhirugavu,  endheru. "
https://storage.googleapis.com/image_prompts/1692885012-7980.jpg_s=612x612_w=0_k=20_c=UxuagyPtwkkjv9Ra9Yxx5OvVaueB7PKkvc77Y9STq_Y=.jpg,286,Male,30-39,Lusoga,yogera_image_audio_20231013_100240.676988_1242.wav,0.0105555555555556,2,1,"Tractor caterpillar, eli kunhinha ku mugongo gwa motoka yinaayo. Motoka yinaayo etaile gho omugongo caterpillar enho enhinhe ku. Side kuliya ghayo ghaligho omusaadha ayambaile nhanhyeragha ya bululu agiringiriire. Side eyindhi eliyo enhumba. "
https://storage.googleapis.com/image_prompts/village3.jpg,281,Female,30-39,Lusoga,yogera_image_audio_20231013_100343.406355_3034.wav,0.00722222222222222,2,1,"Wano ndilengerawo oluguudo, ndiboonawo oluguudo. Waliwo nensiko ya kiragala. Ndirengala namayumba. Eriyo enhumba eriko eibaati eikaire ni langi kumbali wano ya kyenvu no buti bwa kiragala. Kuliku amakoola ga kiragala"
https://storage.googleapis.com/image_prompts/1692884921-6639.jpg_s=612x612_w=0_k=20_c=v6EiJaYwVMXdwU1KVWxyO4a55hryOWuLwDfF_LgY1q0=.jpg,292,Male,18-29,Lusoga,yogera_image_audio_20231013_100534.472171_1676.wav,0.00444444444444444,2,1,Ensolo diri kuzaanhira mu maadhi. Ensolo nnhingi. Dha langi ndirugavu 
https://storage.googleapis.com/image_prompts/1692880134-468.3_ixid=M3wxMjA3fDB8MHxzZWFyY2h8OXx8dWdhbmRhfGVufDB8fDB8fHww_w=1000_q=80.jpg,287,Male,18-29,Lusoga,yogera_image_audio_20231013_100621.577626_1008.wav,0.00666666666666667,3,0,"Abaana abaghala n'abaana abalenzi bali kukina amakina. 

Besibye obunhere munkoto nga bubita kumbirizi. Besiba ebikata ebiliku amooya ameeru. Balikukina makina ga bughangwa. Abana bano bali maddu ghangulu. "
https://storage.googleapis.com/image_prompts/pexels-photo-849524.jpeg,283,Male,18-29,Lusoga,yogera_image_audio_20231013_100644.950748_2556.wav,0.00555555555555556,3,0,"Ebibala ebitereibwa mu busero nga biri mu kala emyufu, endhirugavu, eya kyenvu nhe ya bululu. Ebibala binho nga biribwa bantu nhe bisolo ebiri nga enkembo nga dhona dhi sobola okulya ebibala bino."
https://storage.googleapis.com/image_prompts/1692884916-6582.jpg_s=612x612_w=0_k=20_c=Q5t7JRgLkMlinoQVGXpnVwjXDeyEuJ0udaDVi1ElSlA=.jpg,281,Female,30-39,Lusoga,yogera_image_audio_20231013_100759.662019_1663.wav,0.00472222222222222,3,0,Ghano ndhi kubonha gho enhumba ye isubi. Nalengeragho nh'obusubisubi bwa kiragala ghansi nh'obuti bwa kiragala ele. Enhumba enho eliku obuti kumbali 
https://storage.googleapis.com/image_prompts/90432fd4-te-tugu-102578_1280.jpg,291,Female,30-39,Lusoga,yogera_image_audio_20231013_100804.500026_1430.wav,0.00611111111111111,2,1,"Abasaadha basatu bali kubinga ente, nga ku basaadha abasatu oghundhi agyigemye okugulu. Nga abasaadha bano oghundhi ali mu saati myuufu, oghundhi ali mu saati...ababiri bali mu saati ndheru "
https://storage.googleapis.com/image_prompts/1692885111-9087.jpg_s=612x612_w=0_k=20_c=fTTdYsmnhfLauVAfhi0QK84nG1U5IywwbAJAANupuBw=.jpg,274,Male,18-29,Lusoga,yogera_image_audio_20231013_101045.582073_1283.wav,0.005,3,0,Amaato agabalambuzi kulubalama olw'enhandha nga gasibibwa agho era nga galinze omugoba ghago okwidha okugasomosa okugatoola okugatwaala ku mutala ogundhi oba okugakozesa.
https://storage.googleapis.com/image_prompts/unsplash-03jCFFL.jpg,300,Male,18-29,Lusoga,yogera_image_audio_20231013_101127.033030_2580.wav,0.00444444444444444,2,1,Abasaadha bali mulyaato babiri. Oghundi ali kuvuga elyaato oghundi atiame mulyaato 
https://storage.googleapis.com/image_prompts/44acfc7a-unsplash-04gj1UN.jpg,292,Male,18-29,Lusoga,yogera_image_audio_20231013_101206.145226_2251.wav,0.00583333333333333,3,0,"Abalenzi bali ku pikipiki bava kunonha maadhi bali kuvuga epikipiki, bali muluguudo olweitaka ghaligho nhe motoka mu maiso gaibwe."
https://storage.googleapis.com/image_prompts/unsplash-7hLjB35.jpg,292,Male,18-29,Lusoga,yogera_image_audio_20231013_101206.155702_2637.wav,0.00583333333333333,3,0,"Abazanhi bo mupira bali kugulwanhira, abandhi bali kwitaka, bali mumpale endhirugavu na masaati aga bululu."
https://storage.googleapis.com/image_prompts/unsplash-7xuwtTY.jpg,273,Male,18-29,Lusoga,yogera_image_audio_20231013_101243.145502_2641.wav,0.00472222222222222,2,1,Omwaana nga ali kwolesa obukodhyo ku kapiira. Onho ayemeleiza akapiira ku kigere kilala nga tika seguka.
https://storage.googleapis.com/image_prompts/945f34d7-unsplash-ntrBozM.jpg,273,Male,18-29,Lusoga,yogera_image_audio_20231013_101243.180246_2124.wav,0.00555555555555556,3,0,Omufumbi ali mu kufumba enkoko. Onho ali mu kufumba enkoko gyebakazaaku obukaze. Ali mukugyigemesa akooma.
https://storage.googleapis.com/image_prompts/d7924700-1692885139-9475.jpg_s612x612_w0_k20_czvkLpuxUcDP4tjSurOz3boEscqeuLmHt_Ps5Uau4.jpg,296,Female,40-49,Lusoga,yogera_image_audio_20231013_101336.808035_1975.wav,0.00416666666666667,3,0,"Amajambiya galighano... Bagawagaile, galighano. Gali mu langi eya kinvunvu era ni kanzimyezimye agamye. Gali ghano. Gawagale, obwoojji bwonka, eeh tokoba"
https://storage.googleapis.com/image_prompts/b037e708-uganda-104491_1280.jpg,296,Female,40-49,Lusoga,yogera_image_audio_20231013_101336.837272_1942.wav,0.005,2,1,"Ebizimbe biri wano, ebizimbe bya matafali ga kitakataka. Waliwo abantu, abantu bano abandi bavaire engoye dakiragala, owundi wa bululu eitale owundi kasayi. Abantu bangi bali kusamba itaka"
https://storage.googleapis.com/image_prompts/1e0b14d5-africa-3936327_1280.jpg,273,Male,18-29,Lusoga,yogera_image_audio_20231013_100653.499762_1792.wav,0.00472222222222222,2,1,Abantu kamaala beyirike ku kamotoka akatinini era nga bano bali mu lugendo okwolekera yebajja
https://storage.googleapis.com/image_prompts/1692884868-6074.jpg_s=612x612_w=0_k=20_c=kocoTDvo662QIfUGfTGyLy-cMr7WbT5Y0i98re2x7rc=.jpg,291,Female,30-39,Lusoga,yogera_image_audio_20231013_101556.073840_1612.wav,0.00583333333333333,3,0,"Emotoka diri mu kifo we dininirwa, abantu we badininira nga bajja mu bifo ebyendawulo nga mulimu abantu bangi, waliwo ebizimbe ebyetoloirewo nga ebizimbe ebyo biri mukalina"
https://storage.googleapis.com/image_prompts/1692884861-5999.jpg_s=612x612_w=0_k=20_c=6-nAE553AwlokPLTWAuzximcJegpxNUN8jik3mM21rs=.jpg,291,Female,30-39,Lusoga,yogera_image_audio_20231013_101556.116687_1601.wav,0.00444444444444444,3,0,"Amasigiri gali abili nga galiku omuliro nga guliku..buli sigili nga eteleibwaku esepiki. Esepiki nga mbwike dhaku, buli sepiki ebwikibwaku."
https://storage.googleapis.com/image_prompts/unsplash-C7irLFN.jpg,293,Male,18-29,Lusoga,yogera_image_audio_20231013_101553.404120_2680.wav,0.005,3,0,Empiso empiso dhebakubisa abaantu kukabina nnhingi inho dhiriku olugambo looma empiso nga nnhingi dhirina langi  ya eya bbululu neyapinkirini.
https://storage.googleapis.com/image_prompts/1692884855-5885.jpg_s=612x612_w=0_k=20_c=bXoK770AaC_SH3AWUAdHEy6jATWJs_Tm6Qc2zah1Tf0=.jpg,291,Female,30-39,Lusoga,yogera_image_audio_20231013_101556.096440_1086.wav,0.00416666666666667,3,0,Omukyanga baguyuye mukiina nga mukiina mulimu tundhubali. Ghansi ghomukyanga kumabali ghagwo ghaligho amabaale
https://storage.googleapis.com/image_prompts/pexels-photo-6152391.jpeg,302,Female,40-49,Lusoga,yogera_image_audio_20231013_101626.262556_2548.wav,0.00694444444444444,3,0,"Kano katale kalimu buli kintu. Kalimu enhanha dhiri mu colour myufu, kasayi mwabamu n' ebivavava mwabamu ebidhandhali"
https://storage.googleapis.com/image_prompts/unsplash-pvqsmch.jpg,284,Male,30-39,Lusoga,yogera_image_audio_20231013_101651.674192_2969.wav,0.00583333333333333,3,0,"Kumbali okwe nhandha kuliku amabaale, amaadhi gali mu langi ya bululu nhe ndheru nga gali kwefukuula iinho, inho lyenhelyenhe."
https://storage.googleapis.com/image_prompts/6f22c7c4-francesco-ungaro-SVLx5Q1pAY8-unsplash.jpg,287,Male,18-29,Lusoga,yogera_image_audio_20231013_101756.916660_1860.wav,0.00833333333333333,2,1,"Emotoka ya Fuso, eli twaala amatooke. Omusaadha ali mu saati endheru elimu obwalaala bwa bululu ghamberi ali inhuma ku motoka enho. Yegemye kungangaga ghangulu. Engangaga dhe motoka enho dha bululu. Mu matooke munho mulimu etundubaali ya kipapaali. Omusaadha oghundhi alambaile gye yebwiise."
https://storage.googleapis.com/image_prompts/unsplash-lG8tMKd.jpg,281,Female,30-39,Lusoga,yogera_image_audio_20231013_101759.510080_2921.wav,0.00444444444444444,3,0,"Abaana bali ghano, oghundi ali mu saati ya kyenvu.Oghundi ayambaile kitengyi, kilimu ebimyuufu. Bali kulumuka."
https://storage.googleapis.com/image_prompts/866e5e67-africa-2665134_1280.jpg,274,Male,18-29,Lusoga,yogera_image_audio_20231013_101826.614260_1352.wav,0.00527777777777778,3,0,Omwana nga ava kunona amaadhi okuva kukiduumo era balisiringisa ni muganda we ebidomolo ebya maadhi bye bali bamaze okusibira ku gaali nga omughala bwa sindika nga omulenzi bwa siringisa
https://storage.googleapis.com/image_prompts/unsplash-5zfaOJk.jpg,274,Male,18-29,Lusoga,yogera_image_audio_20231013_101826.626287_2620.wav,0.00444444444444444,3,0,Omukazi nh'omwana ghe omuto ku mugongo nga bali mu nhimiro. Nga omwana ali ku mugongo gwa mama ghe nga aye atendhwiike nh'okutendhuka ku lw'obukoowu obungyi.
https://storage.googleapis.com/image_prompts/village.jpg,277,Female,50-59,Lusoga,yogera_image_audio_20231013_101851.781296_3032.wav,0.00833333333333333,3,0,Amaka amakalamu gabaku engyira ekutwaala yo. Amaka gano galina engyira ekutuusayo. Aye kumaandhi kwe ngyira kuliku eisubi elya laangi ya kiragala. Ghamberi ghenhumba enho baanike gho engoye kulusuubo. Mumaandhi omw'enhumba enho mulimu enhumba eyindhi eli kuzimbibwa ate enhuma gh'enhumba dhino dhombiliri ghaliyo ekibira ekiziziigavu. Kumaandhi kw'enhumba eli kuzimbibwa ghaliyo olusuku olw'ebigogo.
https://storage.googleapis.com/image_prompts/unsplash-aEA0D0u.jpg,294,Female,18-29,Lusoga,yogera_image_audio_20231013_101936.040096_2838.wav,0.005,3,0,Omuntu ayambaire olugoye lweeru agemye ku miguwa. Omuntu mwirugavu. Einhuma we langi nderu.
https://storage.googleapis.com/image_prompts/3b148e53-unsplash-8YOPZLj.jpg,297,Male,18-29,Lusoga,yogera_image_audio_20231013_102017.469498_2243.wav,0.00527777777777778,3,0,"Endhovu enhenhe eli kumpi nh'ekibira. Endhovu enho eliku amasaanga, nh'amatu amanhenhe. Ekibira kinho enho kidhwiile emiti egya kiragala, ghabagho nh'eisubi elyakala ghano okumpi nh'endhovu enho. Endhovu enho gheli mulimu emiti egya kala. "
https://storage.googleapis.com/image_prompts/1692884916-6599.jpg_s=612x612_w=0_k=20_c=6tIzmJqSFBf4UFSt2ryKhvQSB-8-iVb-fa-9DfvHHE8=.jpg,273,Male,18-29,Lusoga,yogera_image_audio_20231013_102033.754792_1191.wav,0.005,2,1,"Gonyaa eri kumbali era nga eno eyolekeire okwedimya mu maadhi, kumbali ghaligho agabaale."
https://storage.googleapis.com/image_prompts/tech.jpg,273,Male,18-29,Lusoga,yogera_image_audio_20231013_102033.777625_2574.wav,0.00527777777777778,2,1,Abasaadha bali kuweesa endigi okuva mu byuuma. Baano bali mu ku kola endigi na madinisa mu byuuma 
https://storage.googleapis.com/image_prompts/f6dd1167-unsplash-iaRXcbc.jpg,282,Male,18-29,Lusoga,yogera_image_audio_20231013_102054.509345_2486.wav,0.00777777777777778,2,1,"Enho ni tulera, emanhibwa nga emotoka etambuza amafuta. Kumbali ghayo ghaligho ekizimbe. Era kumbali ghayo ghaligho n'emiti egy'amasanhalaze. Era  e wire dh'amasanhalaze  dhaba nga dhibita ghangulu gh'emotoka enho."
https://storage.googleapis.com/image_prompts/1692884875-6170.jpg_s=612x612_w=0_k=20_c=uJiMsjQXH4vF--ulhlJm7-vK8fPvnnWVLD75DRjukPY=.jpg,293,Male,18-29,Lusoga,yogera_image_audio_20231013_102056.654727_1621.wav,0.005,2,1,"Enhumba eliku amabaati, n'kigangu bakiziimba ba kitaaku emiti. Eisubi lingyi n'ebigogo byona bingyi. Ebigogo biliku endagala n'amatooke. N'ekiyumba kili kumbali ghale mu bigogo."
https://storage.googleapis.com/image_prompts/1692884875-6169.jpg_s=612x612_w=0_k=20_c=pAmcsb0_miHiYofgdcQd4PAACtv_r2Job7Scd_1x2Yg=.jpg,296,Female,40-49,Lusoga,yogera_image_audio_20231013_102105.842106_1620.wav,0.00416666666666667,3,0,"Enho nhandha amaadhi ga bulu omugemu n'eigulu lya bululu omutangavu kuliku emiti, emiti giriku amakoola ga kiragala, kumbali kwabaku n'agabaalebaale ga kitakataka. Amaadhi gali ghanho."
https://storage.googleapis.com/image_prompts/unsplash-gYs6NJn.jpg,287,Male,18-29,Lusoga,yogera_image_audio_20231013_102437.944783_2887.wav,0.00611111111111111,3,0,"Omusaadha ayambaire enkofira kumutwe ndhirugavu yayambala kabuti yabululu. Alikwetegereza olutindho, olutindho lunho lumyufu olutindho lunho lwankoba. Einhuma ere eriyo ebireli bya bululu."
https://storage.googleapis.com/image_prompts/unsplash-C7irLFN.jpg,292,Male,18-29,Lusoga,yogera_image_audio_20231013_102535.260290_2680.wav,0.00611111111111111,3,0,"Empiso inhingi badikunganikiza ghalala. Dhirimu elangi eya kisayi, dhabamu elangi enderu "
https://storage.googleapis.com/image_prompts/1692885059-8515.jpg_s=612x612_w=0_k=20_c=4uxhgmMsaRprgc1OdaBp89hQP5JYw7db-50OvNNalFs=.jpg,303,Female,18-29,Lusoga,yogera_image_audio_20231013_102536.224505_1267.wav,0.00472222222222222,2,1,"Ekizimbe kyebazanhiramu ebyemizanho, kuliya ghakyo ghaligho bodaboda, kumbali ghakyo ghaligho emotoka."
https://storage.googleapis.com/image_prompts/1692884849-5820.jpg_s=612x612_w=0_k=20_c=0wmns8btGi-eswHdOVeMrTC-OINLaoa3-qsebyHmUUI=.jpg,294,Female,18-29,Lusoga,yogera_image_audio_20231013_102544.855947_1511.wav,0.00833333333333333,2,1,"Ebisolo bibiri, ekisolo ekindhi kiliku eyiga elimpi n'eighanvu ne kutu. Ebisolo ebyo biri mulangi endhirugavu ghano kunda langi ya kyenvu. Bili kumpi n'eisubi ne miti, emiti egyo giri mu langi ya kiragala n'emiti...n'eisubi."
https://storage.googleapis.com/image_prompts/pexels-photo-6192532.jpeg,294,Female,18-29,Lusoga,yogera_image_audio_20231013_102544.877381_2550.wav,0.00694444444444444,3,0,"Abantu bali kutambula mu katale, bali kutunda ebintu enhanha, duuma omuntu oghundhi omukazi ayambaile ekiteteeyi kirimu ekirugavu, akamyufu."
https://storage.googleapis.com/image_prompts/9bb0a808-_DSC0058_copy.jpg,273,Male,18-29,Lusoga,yogera_image_audio_20231013_102556.294191_1899.wav,0.00472222222222222,3,0,"Omukazi atendhwiike, ali mu kutunda embooli nh'amayuuni. Aye nga kiraga nti mukoowu inho."
https://storage.googleapis.com/image_prompts/fb548097-unsplash-RrgXCmG.jpg,274,Male,18-29,Lusoga,yogera_image_audio_20231013_102621.416649_2490.wav,0.00666666666666667,3,0,"Omusaadha nga ayambaire enkoofira, nga abekeile nh'eibumba, nga era agemye olu pipe ali kufughera ebilime. Nga era onho alinamu jacket nhi gumboots ghansi, edhi mwambaku okukola omulimu gunho ogw'ofughera ebilime bye nti bikule bulungi. "
https://storage.googleapis.com/image_prompts/pexels-photo-3376799.webp,296,Female,40-49,Lusoga,yogera_image_audio_20231013_102646.216757_2527.wav,0.00416666666666667,2,1,Banho bali mugusenge oghundhi ali ku kebera bwa idhandhaba bonhabonha ebivalo byeibwe bya bululu.  Beteireku ebizibagho ku minhwa nhi ku maiso ebiziyia obughuka okuvere...
https://storage.googleapis.com/image_prompts/7d3623f3-flat-tire-2882302_1280.jpg,279,Female,18-29,Lusoga,yogera_image_audio_20231013_102926.650006_1872.wav,0.00666666666666667,2,1,"Omusaadha alisimulula omupiira omwirugavu, atweiremu nho lupanka lwaku ali gusikamu aveire esati ndhirugavu eriku ebimyufu ku mikonho. Empale yonha ndhirugavu ghayemeleire gha kisitaka. Omusaadha oyo alinze ghansi enviri dhe nto, ali kozesa omukono ogulya."
https://storage.googleapis.com/image_prompts/unsplash-Me6iM2P.jpg,286,Male,30-39,Lusoga,yogera_image_audio_20231013_102934.958862_2746.wav,0.00611111111111111,2,1,Ebimuli bili mu laangi. Ebimuli byamulika aye obumuli obwo buli mu laangi ya kakobe. Ghaligho endhoki eli kubuluka eli kwendha okugwa ku bimuli okwo.
https://storage.googleapis.com/image_prompts/Image Prompts/Fishing/a2414e1a-gfa02c9fc2cae30d1e8dd28aec9dcd6c4f75daf83b2b684cb5c952ab021541287d296_a8yDfx2.jpg,277,Female,50-59,Lusoga,yogera_image_audio_20231013_102954.861095_2147.wav,0.00666666666666667,3,0,"Amaato gali kumaadhi. Amaadhi malavu kubanga amaato gemereire agho. Amaato gali mulangi eya bululu ni mulangi eya kiragala. Kumandi okwa maato ago waliwo ebinoni ebiri mwibbanga. Ebinooni ebindhi biri gubuluka, ebinoni ebindhi biri kwika ghansi mu maadhi "
https://storage.googleapis.com/image_prompts/Battle to Feed the World Pits Small Farmers against Big Agriculture - Organic Consumers.jpeg,292,Male,18-29,Lusoga,yogera_image_audio_20231013_103000.688187_2134.wav,0.00694444444444444,3,0,Omukazi agemye embago ali kulima. Ghaliwo ebirime byali kulima. Biri mulangi ya kiragala. Yesibiye ekilesu kya langi ya kisayi
https://storage.googleapis.com/image_prompts/1692884849-5831.jpg_s=612x612_w=0_k=20_c=iWICFCRPfS_aifMEsxyWICkDtYJ99Y3xx4hsgmR3xFA=.jpg,277,Female,50-59,Lusoga,yogera_image_audio_20231013_102954.827506_1520.wav,0.00722222222222222,2,1,"Embeera endhaavu n'ekitundhu ekiraavu. Oluguudho luli kubita mu kitundhu ekiraavu. Oluguudho luno luli mu laangi ya kisiitaka, kumaandhi kwalwo kuliku e laangi eya kiragalalagala. Emberi gh'oluguudho yeluli kugolola, eliyo ebileri byolengera."
https://storage.googleapis.com/image_prompts/unsplash-xsU7xvT.jpg,285,Male,18-29,Lusoga,yogera_image_audio_20231013_103011.369269_3020.wav,0.00611111111111111,3,0,"Omusaadha afunhye engalo dhonadhona nga engalo edho dhili mulangi endhirugavu n'endheru, agughanhike."
https://storage.googleapis.com/image_prompts/3eee3187-_DSC0035_copy.jpg,302,Female,40-49,Lusoga,yogera_image_audio_20231013_103042.229343_1821.wav,0.0111111111111111,3,0,"Abasaadha batyaime aghali amatooke. Bagagemyeeku. Bagemye ku binhonkoliilo. Omusaadha oghundhi ali kulya ekibala. Ali kulya ekibala. Yenha ali agho kumpi nh'amatooke, atyaime ghegali. Ghano katale ka matooke. Ghaligho enhaanha. Amatooke gali mu colour ya kiragala. "
https://storage.googleapis.com/image_prompts/1692884889-6321.jpg_s=612x612_w=0_k=20_c=SNBccfvkm7x4jovV6C3_1ZBDfMaAVz7w151Oi11U9Vs=.jpg,273,Male,18-29,Lusoga,yogera_image_audio_20231013_103049.433666_1169.wav,0.00416666666666667,2,1,"Ensenene edimaze okutekatekebwa okulya, dino disavuwaire era nga disikiriza omuli"
https://storage.googleapis.com/image_prompts/bd01f014-unsplash-vRbVZNh.jpg,297,Male,18-29,Lusoga,yogera_image_audio_20231013_103259.540887_2415.wav,0.00583333333333333,2,1,Entwiga isatu ede nkoto empaavu dirimu elangi enderu ne langi ya kisitaka. Entwiga dino eno diri mukibira awali eisubi erya yakanilira ne miti egya kisitaka. Kumpi waliwo no lusozi
https://storage.googleapis.com/image_prompts/pexels-photo-3889930.jpeg,292,Male,18-29,Lusoga,yogera_image_audio_20231013_103240.516863_2533.wav,0.00472222222222222,3,0,Omusaadha ali ku lyaato agemye enkasi. Mumaiso yali kugya waliyo enhumba. Mwenhe ali mulyaato ku maadhi.
